20897,NAGAR PARISHAD SITAMARHI KSHTRA ANTARGAT WARD NO. 23 ME  KIRAN CHWK SE DEEPAK STORES TAK SARAK KE UTARI BAGH ME PAVER BLOCK PATH NIRMAN KARYA,NAGAR PARISHAD SITAMARHI KSHTRA ANTARGAT WARD NO. 23 ME  KIRAN CHWK SE DEEPAK STORES TAK SARAK KE UTARI BAGH ME PAVER BLOCK PATH NIRMAN KARYA,538.800.2032.,NAGAR PARISHAD SITAMARHI KSHTRA ANTARGAT WARD NO. 23 ME  KIRAN CHWK SE DEEPAK STORES TAK SARAK KE UTARI BAGH ME PAVER BLOCK PATH NIRMAN KARYA,2759900.0,04/2021-22 MUNICIPAL COMMISSIONER SITAMARHII,2022-04-13,180,INR,,101,101,1557,2032,2,N,,6,13-04-2022,2759900.0
21559,"Construction of UG Drain & PCC Road work from Raju Saw House to Manoj 
Kumar house Under ward No-55 PMC, Patna.","Construction of UG Drain & PCC Road work from Raju Saw House to Manoj 
Kumar house Under ward No-55 PMC, Patna.",538.1517.1545.,"Construction of UG Drain & PCC Road work from Raju Saw House to Manoj 
Kumar house Under ward No-55 PMC, Patna.",112600.0,"01/E/KAN/2022-23, Group No.-40",2022-04-28,180,INR,,101,101,1557,1545,1,N,,7,28-04-2022,112600.0
20949,"Supplying of spare parts for the work of Repair to tube well of I.M-II, I.M-III and  ordinary/Singur handpump in the District of Madhubani under P.H. Division Jhanjharpur","Supplying of spare parts for the work of Repair to tube well of I.M-II, I.M-III and  ordinary/Singur handpump in the District of Madhubani under P.H. Division Jhanjharpur",538.790.791.1073.2021.,"Supplying of spare parts for the work of Repair to tube well of I.M-II, I.M-III and  ordinary/Singur handpump in the District of Madhubani under P.H. Division Jhanjharpur",1213642.0,NIT No 1/2022-23 (R1)/Jha,2022-04-16,120,INR,,101,101,1557,2021,2,N,,7,16-04-2022,1213642.0
21031,Construction of PCC road & U/G drain in Khajurbanna Gali in ward no.57 under Urban Development Division Azimabad PMC Patna,Construction of PCC road & U/G drain in Khajurbanna Gali in ward no.57 under Urban Development Division Azimabad PMC Patna,538.1517.1548.,Construction of PCC road & U/G drain in Khajurbanna Gali in ward no.57 under Urban Development Division Azimabad PMC Patna,484264.0,01/E/AZIMABAD/2022-23/GR 26,2022-04-21,120,INR,,101,101,1557,1548,1,N,,7,19-04-2022,484264.0
20630,Construction of  PCC Road and UG drain from Lalmuni Ji house Umesh Ji Jalpura House in ward no-08,Construction of  PCC Road and UG drain from Lalmuni Ji house Umesh Ji Jalpura House in ward no-08,538.1517.1546.,Construction of  PCC Road and UG drain from Lalmuni Ji house Umesh Ji Jalpura House in ward no-08,180438.0,NIT NO-07/E/PATLIPUTRA /2022 Gr-08,2022-04-04,180,INR,,101,101,1557,1546,1,N,,4,02-04-2022,180438.0
20802,CONSTRUCTION  OF ONE STOP CENTER BUILDING IN  J.L.N.M.C.H MAYAGANJ AT BHAGALPUR.,CONSTRUCTION  OF ONE STOP CENTER BUILDING IN  J.L.N.M.C.H MAYAGANJ AT BHAGALPUR.,538.1026.1095.1196.1197.,CONSTRUCTION  OF ONE STOP CENTER BUILDING IN  J.L.N.M.C.H MAYAGANJ AT BHAGALPUR.,4570067.0,E-TENDER 09/EEBDBGP/2021-2022,2022-04-11,120,INR,,101,101,1557,1197,2,N,,7,11-04-2022,4570067.0
21276,"??? ?????? ???? ?????  ??????????????? ??? ?????, ?????? ??? ??? ?????? ?? ???-??-??? ???? ??? ???? ???? ?? ????, ??????? ????, ????-???? ????? ??? ????? ?? ????? ??? ?? ?????? ?? ??????","??? ?????? ???? ?????  ??????????????? ??? ?????, ?????? ??? ??? ?????? ?? ???-??-??? ???? ??? ???? ???? ?? ????, ??????? ????, ????-???? ????? ??? ????? ?? ????? ??? ?? ?????? ?? ??????",538.800.1245.,"??? ?????? ???? ?????  ??????????????? ??? ?????, ?????? ??? ??? ?????? ?? ???-??-??? ???? ??? ???? ???? ?? ????, ??????? ????, ????-???? ????? ??? ????? ?? ????? ??? ?? ?????? ?? ??????",0.0,NIT-01/2022-23 Ekma Bazar,2022-04-25,120,INR,,102,101,1554,1245,2,N,,7,25-04-2022,0.0
21126,"REMAINING WORK FOR CONSTRUCTION  OF GOVERNMENT ENGINEERING COLLEGE, AT KISHANGANJ","REMAINING WORK FOR CONSTRUCTION  OF GOVERNMENT ENGINEERING COLLEGE, AT KISHANGANJ",538.1026.1096.1219.1222.,"REMAINING WORK FOR CONSTRUCTION  OF GOVERNMENT ENGINEERING COLLEGE, AT KISHANGANJ",129407467.0,08/BCD/KISHANGANJ/2022-2023,2022-04-21,120,INR,,101,101,1557,1222,2,N,,6,21-04-2022,129407467.0
21571,"CONSTRUCTION OF U/G DRAIN SANJAY GANDHI NAGAR 
ROAD NO -6 TO 7. UNDER WARD NO-45 OF PMC, PATNA.","CONSTRUCTION OF U/G DRAIN SANJAY GANDHI NAGAR 
ROAD NO -6 TO 7. UNDER WARD NO-45 OF PMC, PATNA.",538.1517.1545.,"CONSTRUCTION OF U/G DRAIN SANJAY GANDHI NAGAR 
ROAD NO -6 TO 7. UNDER WARD NO-45 OF PMC, PATNA.",947300.0,"03/E/KAN/2022-23, Group No.-02",2022-04-28,180,INR,,101,101,1557,1545,1,N,,4,28-04-2022,947300.0
20628,Construction of PCC Road in Kautilya Nagar H/o Nageshwar Prasad to Plulchand Gupta to Prabha Kunj in ward no-08,Construction of PCC Road in Kautilya Nagar H/o Nageshwar Prasad to Plulchand Gupta to Prabha Kunj in ward no-08,538.1517.1546.,Construction of PCC Road in Kautilya Nagar H/o Nageshwar Prasad to Plulchand Gupta to Prabha Kunj in ward no-08,354350.0,NIT NO-07/E/PATLIPUTRA /2022 Gr-06,2022-04-04,180,INR,,101,101,1557,1546,1,N,,6,02-04-2022,354350.0
20845,Renovation of Mahuyet Tal pyne irrigation System,Renovation of Mahuyet Tal pyne irrigation System,538.1420.1422.1426.1441.,Renovation of Mahuyet Tal pyne irrigation System,21468632.0,13/2021-22/ GP-02,2022-04-12,120,INR,,101,101,1557,1441,2,N,,7,12-04-2022,21468632.0
21541,"ESTIM ATE OF CONSTRUCTION OF U/G DRAIN AND PCC 
ROAD WORK FROM GUDDU SINGH HOUSE TO GYAN RAY HOUSE IN YOGIPUR 
MOHALLA UNDER WARD NO-45 OF PMC PATNA","ESTIM ATE OF CONSTRUCTION OF U/G DRAIN AND PCC 
ROAD WORK FROM GUDDU SINGH HOUSE TO GYAN RAY HOUSE IN YOGIPUR 
MOHALLA UNDER WARD NO-45 OF PMC PATNA",538.1517.1545.,"ESTIM ATE OF CONSTRUCTION OF U/G DRAIN AND PCC 
ROAD WORK FROM GUDDU SINGH HOUSE TO GYAN RAY HOUSE IN YOGIPUR 
MOHALLA UNDER WARD NO-45 OF PMC PATNA",230000.0,"01/E/KAN/2022-23, Group No.-25",2022-04-28,180,INR,,101,101,1557,1545,1,N,,7,28-04-2022,230000.0
21064,"Proposal for ?Supply of Handheld Scanner and Mobile X-Ray scanner on Rental basis? for Prohibition, Excise & Registration Department, Government of Bihar","Proposal for ?Supply of Handheld Scanner and Mobile X-Ray scanner on Rental basis? for Prohibition, Excise & Registration Department, Government of Bihar",538.2024.,"Proposal for ?Supply of Handheld Scanner and Mobile X-Ray scanner on Rental basis? for Prohibition, Excise & Registration Department, Government of Bihar",0.0,Handheld and Mobile Scanner/Excise/2022/02,2022-04-19,180,INR,,102,101,1554,2024,2,N,,7,19-04-2022,0.0
20921,Supply of New Empty Cement bags of capacity 1.2 Cft. as per specification for different Divisional / Central Godown under Chief Engineer Samastipur & Birpur Zone of WRD.,Supply of New Empty Cement bags of capacity 1.2 Cft. as per specification for different Divisional / Central Godown under Chief Engineer Samastipur & Birpur Zone of WRD.,538.731.1849.1850.,Supply of New Empty Cement bags of capacity 1.2 Cft. as per specification for different Divisional / Central Godown under Chief Engineer Samastipur & Birpur Zone of WRD.,0.0,Short NIQ No: 01/2022-23/Gr01,2022-04-14,203,INR,,102,101,999,1850,2,N,,7,14-04-2022,0.0
21023,Construction of Boundary wall of Nehru shishu karpoori Thakur park at arfabad colony in ward 54 under urban development division Azimabad,Construction of Boundary wall of Nehru shishu karpoori Thakur park at arfabad colony in ward 54 under urban development division Azimabad,538.1517.1548.,Construction of Boundary wall of Nehru shishu karpoori Thakur park at arfabad colony in ward 54 under urban development division Azimabad,970505.0,01/E/AZIMABAD/2022-23/GR 19,2022-04-21,120,INR,,101,101,1557,1548,1,N,,7,18-04-2022,970505.0
20639,Construction of PCC Road from Sukari Yadav to Shiv Saran Ji Chunnu Ji to Bhushan Ji house in ward no-08,Construction of PCC Road from Sukari Yadav to Shiv Saran Ji Chunnu Ji to Bhushan Ji house in ward no-08,538.1517.1546.,Construction of PCC Road from Sukari Yadav to Shiv Saran Ji Chunnu Ji to Bhushan Ji house in ward no-08,131923.0,NIT NO-07/E/PATLIPUTRA /2022 Gr-15,2022-04-04,180,INR,,101,101,1557,1546,1,N,,4,02-04-2022,131923.0
20740,Construction of U/G drain and PCC road from Road No-15 E  to Gauri  Shankar Singh H/O to Nagendra Ray  in ward no-01,Construction of U/G drain and PCC road from Road No-15 E  to Gauri  Shankar Singh H/O to Nagendra Ray  in ward no-01,538.1517.1546.,Construction of U/G drain and PCC road from Road No-15 E  to Gauri  Shankar Singh H/O to Nagendra Ray  in ward no-01,1730300.0,NIT NO-07/E/PATLIPUTRA /2022 Gr-102,2022-04-04,180,INR,,101,101,1557,1546,1,N,,7,04-04-2022,1730300.0
21046,Detailed estimate for Renovation of drain in front of Kids glow world school at Dak bangla road in ward no:- 20 under Nagar parishad Madhepura. during year 2021-22,Detailed estimate for Renovation of drain in front of Kids glow world school at Dak bangla road in ward no:- 20 under Nagar parishad Madhepura. during year 2021-22,538.800.896.,Detailed estimate for Renovation of drain in front of Kids glow world school at Dak bangla road in ward no:- 20 under Nagar parishad Madhepura. during year 2021-22,134500.0,GR08/NIT01/NP MADHEPURA/2022-23,2022-04-19,90,INR,,101,101,1557,896,1,N,,7,19-04-2022,134500.0
20916,"A.E WORK 2022- RESTORATION  OF SCREEN( COFFER DAM),  DEFLACTORS AT U/S, SHOAL CUTTING & RIVER EDGE  PROTECTION  IN FRONT OF  KM 46.0 OF BAGMATI LEFT EMBANKMENT  NEAR DO- DHARA KHARKA  VILLAGE. (AGENDA NO.-182/56/2022)","A.E WORK 2022- RESTORATION  OF SCREEN( COFFER DAM),  DEFLACTORS AT U/S, SHOAL CUTTING & RIVER EDGE  PROTECTION  IN FRONT OF  KM 46.0 OF BAGMATI LEFT EMBANKMENT  NEAR DO- DHARA KHARKA  VILLAGE. (AGENDA NO.-182/56/2022)",538.731.972.1052.,"A.E WORK 2022- RESTORATION  OF SCREEN( COFFER DAM),  DEFLACTORS AT U/S, SHOAL CUTTING & RIVER EDGE  PROTECTION  IN FRONT OF  KM 46.0 OF BAGMATI LEFT EMBANKMENT  NEAR DO- DHARA KHARKA  VILLAGE. (AGENDA NO.-182/56/2022)",69705353.0,01SBD/2022-23/RUNNISAIDPUR,2022-04-14,120,INR,,101,101,1557,1052,2,N,,7,14-04-2022,69705353.0
21530,"Construction of 50 No. 125mm X 40mm X 61M deep Tube well with I.M.-II Hand Pump, Platform , Drain and Soakpit under scheme for Sinking of New Handpumps & Construction of soak pit of 1.0 m diameter & 2.0 m deep with dry brick honey comb shaft with bricks of class designation 100B etc near Handpump.in the place of  defunct Handpump & in the water Scarce area for the year 2022-23 in Madhubani District under P.H. Division, jhanjharpur.NIT NO 2/2022-23/JHANJHARPUR GROUP 2","Construction of 50 No. 125mm X 40mm X 61M deep Tube well with I.M.-II Hand Pump, Platform , Drain and Soakpit under scheme for Sinking of New Handpumps & Construction of soak pit of 1.0 m diameter & 2.0 m deep with dry brick honey comb shaft with bricks of class designation 100B etc near Handpump.in the place of  defunct Handpump & in the water Scarce area for the year 2022-23 in Madhubani District under P.H. Division, jhanjharpur.NIT NO 2/2022-23/JHANJHARPUR GROUP 2",538.790.791.1073.2021.,"Construction of 50 No. 125mm X 40mm X 61M deep Tube well with I.M.-II Hand Pump, Platform , Drain and Soakpit under scheme for Sinking of New Handpumps & Construction of soak pit of 1.0 m diameter & 2.0 m deep with dry brick honey comb shaft with bricks of class designation 100B etc near Handpump.in the place of  defunct Handpump & in the water Scarce area for the year 2022-23 in Madhubani District under P.H. Division, jhanjharpur.NIT NO 2/2022-23/JHANJHARPUR GROUP 2",3444896.0,NIT NO 2/2022-23/JHANJHARPUR GROUP 2,2022-04-28,120,INR,,101,101,1557,2021,2,N,,7,28-04-2022,3444896.0
20859,The Work of Draining the Drain through the Goenka School to Hightech Balaji Nagar via Kusum Community Hall to Cantt Nala under Nagar Parishad Danapur Nizamat.,The Work of Draining the Drain through the Goenka School to Hightech Balaji Nagar via Kusum Community Hall to Cantt Nala under Nagar Parishad Danapur Nizamat.,538.800.1334.,The Work of Draining the Drain through the Goenka School to Hightech Balaji Nagar via Kusum Community Hall to Cantt Nala under Nagar Parishad Danapur Nizamat.,1238500.0,MCD-NIT-01/2022-23-GR-04,2022-04-13,120,INR,,101,101,1557,1334,1,N,,7,13-04-2022,1238500.0
20849,Renovation of Manar Bandh  Ahar Pyne  Irrigation System,Renovation of Manar Bandh  Ahar Pyne  Irrigation System,538.1420.1422.1426.1441.,Renovation of Manar Bandh  Ahar Pyne  Irrigation System,50843117.0,13/2021-22/ GP-06,2022-04-12,120,INR,,101,101,1557,1441,2,N,,7,12-04-2022,50843117.0
21577,"CONSTRUCTION OF U/G DRAIN WORK FROM 
BHAGWAT NAGAR SBI TO RAMBABU MARKET UNDER WARD NO-55 OF 
PMC, PATNA.","CONSTRUCTION OF U/G DRAIN WORK FROM 
BHAGWAT NAGAR SBI TO RAMBABU MARKET UNDER WARD NO-55 OF 
PMC, PATNA.",538.1517.1545.,"CONSTRUCTION OF U/G DRAIN WORK FROM 
BHAGWAT NAGAR SBI TO RAMBABU MARKET UNDER WARD NO-55 OF 
PMC, PATNA.",1985500.0,"03/E/KAN/2022-23, Group No.-05",2022-04-28,180,INR,,101,101,1557,1545,1,N,,7,28-04-2022,1985500.0
20865,"RENOVATION OF 24 (Twenty Four) No. OLD STATE TUBE WELL UNDER MINOR IRRIGATION DIVISION, PATNA","RENOVATION OF 24 (Twenty Four) No. OLD STATE TUBE WELL UNDER MINOR IRRIGATION DIVISION, PATNA",538.1420.1422.1425.1434.,"RENOVATION OF 24 (Twenty Four) No. OLD STATE TUBE WELL UNDER MINOR IRRIGATION DIVISION, PATNA",53420000.0,13/2021-22/MID/PATNA/17,2022-04-13,120,INR,,101,101,1557,1434,2,N,,7,13-04-2022,53420000.0
21183,NAGAR PARISHAD WARD 06 ME HASNAN KHAN KE GHAR SE KABRISTAN GATE TAK NALA AVM ROAD NIRMAN KARYA,NAGAR PARISHAD WARD 06 ME HASNAN KHAN KE GHAR SE KABRISTAN GATE TAK NALA AVM ROAD NIRMAN KARYA,538.800.1991.,NAGAR PARISHAD WARD 06 ME HASNAN KHAN KE GHAR SE KABRISTAN GATE TAK NALA AVM ROAD NIRMAN KARYA,1571300.0,04/2021-22 GR06,2022-04-24,180,INR,,101,101,1557,1991,1,N,,7,24-04-2022,1571300.0
21204,NAGAR PARISHAD WARD 07 ME NAND KISHORE KE GHAR SE HARENDRA KE CHARAN HOTE HUE NAND JEE KE DALAN TAK MITTI BHARAI NALI TATHA PATH NIRMAN KARYA,NAGAR PARISHAD WARD 07 ME NAND KISHORE KE GHAR SE HARENDRA KE CHARAN HOTE HUE NAND JEE KE DALAN TAK MITTI BHARAI NALI TATHA PATH NIRMAN KARYA,538.800.1991.,NAGAR PARISHAD WARD 07 ME NAND KISHORE KE GHAR SE HARENDRA KE CHARAN HOTE HUE NAND JEE KE DALAN TAK MITTI BHARAI NALI TATHA PATH NIRMAN KARYA,658000.0,04/2021-22 GR25,2022-04-24,180,INR,,101,101,1557,1991,1,N,,7,24-04-2022,658000.0
21054,"Empanelment of Bidders for Design, supply, erection, testing, and commissioning including warranty, Comprehensive operation & maintenance for 5 Years of Grid-Connected Rooftop Solar Plant for a total capacity of 20 MW in Residential Sectors under the Phase-II of Grid Connected Rooftop Solar Scheme of MNRE in the State/operational area of North Bihar Power Distribution Company Limited (NBPDCL) & South Bihar Power Distribution Company Limited (SBPDCL).","Empanelment of Bidders for Design, supply, erection, testing, and commissioning including warranty, Comprehensive operation & maintenance for 5 Years of Grid-Connected Rooftop Solar Plant for a total capacity of 20 MW in Residential Sectors under the Phase-II of Grid Connected Rooftop Solar Scheme of MNRE in the State/operational area of North Bihar Power Distribution Company Limited (NBPDCL) & South Bihar Power Distribution Company Limited (SBPDCL).",538.1025.1164.1165.1175.,"Empanelment of Bidders for Design, supply, erection, testing, and commissioning including warranty, Comprehensive operation & maintenance for 5 Years of Grid-Connected Rooftop Solar Plant for a total capacity of 20 MW in Residential Sectors under the Phase-II of Grid Connected Rooftop Solar Scheme of MNRE in the State/operational area of North Bihar Power Distribution Company Limited (NBPDCL) & South Bihar Power Distribution Company Limited (SBPDCL).",0.0,05/PR/NBPDCL/2022,2022-04-20,180,INR,,102,101,1522,1175,2,N,,7,19-04-2022,0.0
20838,NIT NO 14/2021-22/MID/ROHTAS/GR16,RENOVATION OF SAKASH AHAR,538.1420.1422.1425.1437.,NIT NO 14/2021-22/MID/ROHTAS/GR16,7101317.0,14/2021-22/MID/ROHTAS SASARAM/16,2022-04-12,120,INR,,101,101,1557,1437,2,N,,7,12-04-2022,7101317.0
20728,Construction Of U/G Drain & PCC Road From Mahavir Vatsalay Hospital Jagmohan singh House To Late Sita Ram Parsad House In Ward-22C,Construction Of U/G Drain & PCC Road From Mahavir Vatsalay Hospital Jagmohan singh House To Late Sita Ram Parsad House In Ward-22C,538.1517.1546.,Construction Of U/G Drain & PCC Road From Mahavir Vatsalay Hospital Jagmohan singh House To Late Sita Ram Parsad House In Ward-22C,2063300.0,NIT NO-07/E/PATLIPUTRA /2022 Gr-92,2022-04-04,180,INR,,101,101,1557,1546,1,N,,7,04-04-2022,2063300.0
20883,NIT 13/2021-22/MID/kaimur/GR15,Madurana Garland Trench Scheme,538.1420.1422.1425.1438.,NIT 13/2021-22/MID/kaimur/GR15,26586150.0,13/2021-22/MID/Kaimur/Gr15,2022-04-13,120,INR,,101,101,1557,1438,2,N,,7,13-04-2022,26586150.0
20580,NIT04/2021-22/MID/Kaimur/gr-01,"Renovation of Auraiya & Ghataiya State Tubewell 
(NABARD Phase XI)",538.1420.1422.1425.1438.,NIT04/2021-22/MID/Kaimur/gr-01,3546955.0,NIT04/2021-22/MID/KAIMUR,2022-04-04,120,INR,,101,101,1557,1438,2,N,,7,30-03-2022,3546955.0
20899,Constraction of Culvert from Md Alijan house in front of east side in ward no- 01 under Nagar parishad Madhepura. during year 2021-22,Constraction of Culvert from Md Alijan house in front of east side in ward no- 01 under Nagar parishad Madhepura. during year 2021-22,538.800.896.,Constraction of Culvert from Md Alijan house in front of east side in ward no- 01 under Nagar parishad Madhepura. during year 2021-22,275000.0,GR20/NIT14/NP MADHEPURA,2022-04-13,90,INR,,101,101,1557,896,1,N,,7,13-04-2022,275000.0
20739,Construction of PCC Road & U/G Drain At Rajeev Nagar Road No-23 H From House of Munna Singh To Anand Gupta House in ward no-01,Construction of PCC Road & U/G Drain At Rajeev Nagar Road No-23 H From House of Munna Singh To Anand Gupta House in ward no-01,538.1517.1546.,Construction of PCC Road & U/G Drain At Rajeev Nagar Road No-23 H From House of Munna Singh To Anand Gupta House in ward no-01,579400.0,NIT NO-07/E/PATLIPUTRA /2022 Gr-101,2022-04-04,180,INR,,101,101,1557,1546,1,N,,7,04-04-2022,579400.0
20839,NIT NO 14/2021-22/MID/ROHTAS/GR17,RENOVATION OF REHAL AHAR,538.1420.1422.1425.1437.,NIT NO 14/2021-22/MID/ROHTAS/GR17,8540858.0,14/2021-22/MID/ROHTAS SASARAM/17,2022-04-12,120,INR,,101,101,1557,1437,2,N,,7,12-04-2022,8540858.0
21071,Construction of 150 mm x 100 mm x 150 M Deep High Yeild Tubewell in Ward No-11 Near Sanjay Yadav House,Construction of 150 mm x 100 mm x 150 M Deep High Yeild Tubewell in Ward No-11 Near Sanjay Yadav House,538.800.826.,Construction of 150 mm x 100 mm x 150 M Deep High Yeild Tubewell in Ward No-11 Near Sanjay Yadav House,420310.0,NPS-NIT-01/2022-23-GR-04,2022-04-19,120,INR,,101,101,1557,826,1,N,,7,19-04-2022,420310.0
20854,RENOVATION OF SENARI MADHAURA AHAR PYNE IRRIGATION SCHEME,RENOVATION OF SENARI MADHAURA AHAR PYNE IRRIGATION SCHEME,538.1420.1422.1426.1443.,RENOVATION OF SENARI MADHAURA AHAR PYNE IRRIGATION SCHEME,33605277.0,13/2021-22/MID/ARWAL GR-08,2022-04-13,120,INR,,101,101,1557,1443,2,N,,7,13-04-2022,33605277.0
20938,"CONSTRUCTION OF  ZILA PANCHAYAT RESOURCE CENTER BUILDING (G + 2) AT MANPUR BLOCK, DISTRICT GAYA, BIHAR","CONSTRUCTION OF  ZILA PANCHAYAT RESOURCE CENTER BUILDING (G + 2) AT MANPUR BLOCK, DISTRICT GAYA, BIHAR",538.1907.1944.,"CONSTRUCTION OF  ZILA PANCHAYAT RESOURCE CENTER BUILDING (G + 2) AT MANPUR BLOCK, DISTRICT GAYA, BIHAR",42847673.0,Re NIT No. 03/2021-22(S.B.D.),2022-04-17,120,INR,,101,101,1557,1944,2,N,,6,15-04-2022,42847673.0
21182,NAGAR PARISHAD WARD 05 ME MAIN ROAD HASIB KHAN KE GHAR SE HOTE HUE KABRISTAN TAK AVM JAINUDDIN KE GHAR AVM MANJUR ALAM KE GHAR KE CHARO TARAF PCC NIRMAN AVM ISTAAF KHAN KE GHAR SE MAIN NALA TAK PCC AVM NALI NIRMAN KARYA,NAGAR PARISHAD WARD 05 ME MAIN ROAD HASIB KHAN KE GHAR SE HOTE HUE KABRISTAN TAK AVM JAINUDDIN KE GHAR AVM MANJUR ALAM KE GHAR KE CHARO TARAF PCC NIRMAN AVM ISTAAF KHAN KE GHAR SE MAIN NALA TAK PCC AVM NALI NIRMAN KARYA,538.800.1991.,NAGAR PARISHAD WARD 05 ME MAIN ROAD HASIB KHAN KE GHAR SE HOTE HUE KABRISTAN TAK AVM JAINUDDIN KE GHAR AVM MANJUR ALAM KE GHAR KE CHARO TARAF PCC NIRMAN AVM ISTAAF KHAN KE GHAR SE MAIN NALA TAK PCC AVM NALI NIRMAN KARYA,1685200.0,04/2021-22 GR05,2022-04-24,180,INR,,101,101,1557,1991,1,N,,7,24-04-2022,1685200.0
21508,"Construction of District Supply food  Chain  Management Centre  at  Munger  with Electrification  work,  for the year 2022-23","Construction of District Supply food  Chain  Management Centre  at  Munger  with Electrification  work,  for the year 2022-23",538.1026.1095.1191.1192.,"Construction of District Supply food  Chain  Management Centre  at  Munger  with Electrification  work,  for the year 2022-23",13639308.0,01/BCD/MUNGER/2022-23,2022-04-27,120,INR,,101,101,1557,1192,2,N,,6,27-04-2022,13639308.0
20988,Construction of Platform at Biscoman Colony near Gobarwa Mahadev Mandir in Ward no 54 under Urban Development Division Azimabad Patna,Construction of Platform at Biscoman Colony near Gobarwa Mahadev Mandir in Ward no 54 under Urban Development Division Azimabad Patna,538.1517.1548.,Construction of Platform at Biscoman Colony near Gobarwa Mahadev Mandir in Ward no 54 under Urban Development Division Azimabad Patna,694255.0,01/E/AZIMABAD/2022-23/GR 06,2022-04-21,120,INR,,101,101,1557,1548,1,N,,6,18-04-2022,694255.0
20957,"Construction of High Yield Tube well in Mushari Toli, LCT Ghat at Ward No. 22-C.","Construction of High Yield Tube well in Mushari Toli, LCT Ghat at Ward No. 22-C.",538.1517.1549.,"Construction of High Yield Tube well in Mushari Toli, LCT Ghat at Ward No. 22-C.",9709500.0,04/E/WSD/2022/PMC/05,2022-04-19,120,INR,,101,101,1557,1549,2,N,,7,16-04-2022,9709500.0
21109,Construction of PCC Road & RCC Drain In Rustam Peer Ali Ki Gali Near Jhunnu Ji House in ward no-59 under Urban development division Azimabad PMC Patna.,Construction of PCC Road & RCC Drain In Rustam Peer Ali Ki Gali Near Jhunnu Ji House in ward no-59 under Urban development division Azimabad PMC Patna.,538.1517.1548.,Construction of PCC Road & RCC Drain In Rustam Peer Ali Ki Gali Near Jhunnu Ji House in ward no-59 under Urban development division Azimabad PMC Patna.,1047864.0,01/E/AZIMABAD/2022-23/GR 32,2022-04-21,120,INR,,101,101,1557,1548,1,N,,7,20-04-2022,1047864.0
21557,"CONSTRUCTION OF UG DRAIN WORK FROM BUDHIYA GARDEN RAMNAGAR 
CIRCLE RAJ PARASD HOUSE TO KAMESHWAER PANDIT HOUSE Under ward No-55 PMC, Patna","CONSTRUCTION OF UG DRAIN WORK FROM BUDHIYA GARDEN RAMNAGAR 
CIRCLE RAJ PARASD HOUSE TO KAMESHWAER PANDIT HOUSE Under ward No-55 PMC, Patna",538.1517.1545.,"CONSTRUCTION OF UG DRAIN WORK FROM BUDHIYA GARDEN RAMNAGAR 
CIRCLE RAJ PARASD HOUSE TO KAMESHWAER PANDIT HOUSE Under ward No-55 PMC, Patna",386100.0,"01/E/KAN/2022-23, Group No.-38",2022-04-28,180,INR,,101,101,1557,1545,1,N,,7,28-04-2022,386100.0
21141,Construction of R.C.C Drain in Hurari Mathani from Bharat Mehta House to Shakka Toli Masjid in Ward no 53 under Azimabad Division PMC Patna,Construction of R.C.C Drain in Hurari Mathani from Bharat Mehta House to Shakka Toli Masjid in Ward no 53 under Azimabad Division PMC Patna,538.1517.1548.,Construction of R.C.C Drain in Hurari Mathani from Bharat Mehta House to Shakka Toli Masjid in Ward no 53 under Azimabad Division PMC Patna,1430961.0,01/E/AZIMABAD/2022-23/GR 61,2022-04-21,120,INR,,101,101,1557,1548,1,N,,7,21-04-2022,1430961.0
21518,"CONSTRUCTION OF U/G DRAIN & PCC ROAD WORK FROM LATE LAKHAN 
SRIVASTAV JEE HOUSE TO SHASHI BHUSHAN VERMA JEE HOUSE UNDER WARD NO-31 PMC. PATNA.","CONSTRUCTION OF U/G DRAIN & PCC ROAD WORK FROM LATE LAKHAN 
SRIVASTAV JEE HOUSE TO SHASHI BHUSHAN VERMA JEE HOUSE UNDER WARD NO-31 PMC. PATNA.",538.1517.1545.,"CONSTRUCTION OF U/G DRAIN & PCC ROAD WORK FROM LATE LAKHAN 
SRIVASTAV JEE HOUSE TO SHASHI BHUSHAN VERMA JEE HOUSE UNDER WARD NO-31 PMC. PATNA.",842570.0,"01/E/KAN/2022-23, Group No.-10",2022-04-28,180,INR,,101,101,1557,1545,1,N,,7,28-04-2022,842570.0
20668,Construction of PCC Road and U/G drain in Panpai Marg from Rajendra Das to Niraj Singh house in ward no-22A,Construction of PCC Road and U/G drain in Panpai Marg from Rajendra Das to Niraj Singh house in ward no-22A,538.1517.1546.,Construction of PCC Road and U/G drain in Panpai Marg from Rajendra Das to Niraj Singh house in ward no-22A,678000.0,NIT NO-07/E/PATLIPUTRA /2022 Gr-44,2022-04-04,180,INR,,101,101,1557,1546,1,N,,7,02-04-2022,678000.0
21189,NAGAR PARISHAD WARD 12 ME KARAHA PAR ASHITH PULIA KE AAGE SE ARA SASARAM ROAD TAK PATH AVM NALI NIRMAN KARYA,NAGAR PARISHAD WARD 12 ME KARAHA PAR ASHITH PULIA KE AAGE SE ARA SASARAM ROAD TAK PATH AVM NALI NIRMAN KARYA,538.800.1991.,NAGAR PARISHAD WARD 12 ME KARAHA PAR ASHITH PULIA KE AAGE SE ARA SASARAM ROAD TAK PATH AVM NALI NIRMAN KARYA,3011000.0,04/2021-22 GR12,2022-04-24,180,INR,,101,101,1557,1991,1,N,,7,24-04-2022,3011000.0
20723,Repair Of Manhole in different places in ward-22c of patliputra division,Repair Of Manhole in different places in ward-22c of patliputra division,538.1517.1546.,Repair Of Manhole in different places in ward-22c of patliputra division,526300.0,NIT NO-07/E/PATLIPUTRA /2022 Gr-87,2022-04-04,180,INR,,101,101,1557,1546,1,N,,7,03-04-2022,526300.0
21073,CONSTRUCTION OF IRRIGATION FIELD CHANNEL AT EX. RD 18.00(L) OF MEHSI DISTRIBUTARY OFFTAKING FROM 536.39 RD(L) OF TIRHUT MAIN CANAL AT VILLAGE KOYLA BELWA UNDER KALYANPUR BLOCK OF EAST CHAMPARAN DISTRICT.    (GR NO. 02),CONSTRUCTION OF IRRIGATION FIELD CHANNEL AT EX. RD 18.00(L) OF MEHSI DISTRIBUTARY OFFTAKING FROM 536.39 RD(L) OF TIRHUT MAIN CANAL AT VILLAGE KOYLA BELWA UNDER KALYANPUR BLOCK OF EAST CHAMPARAN DISTRICT.    (GR NO. 02),538.731.1142.1155.,CONSTRUCTION OF IRRIGATION FIELD CHANNEL AT EX. RD 18.00(L) OF MEHSI DISTRIBUTARY OFFTAKING FROM 536.39 RD(L) OF TIRHUT MAIN CANAL AT VILLAGE KOYLA BELWA UNDER KALYANPUR BLOCK OF EAST CHAMPARAN DISTRICT.    (GR NO. 02),3057123.0,NIT01/2022-23/EE TCD CHAKIA/GR02,2022-04-19,180,INR,,101,101,1557,1155,2,N,,7,19-04-2022,3057123.0
