20707,Construction of PCC Road and U/G drain in Anandpuri from Taralok to Bhusan Prasad house in ward no-23,Construction of PCC Road and U/G drain in Anandpuri from Taralok to Bhusan Prasad house in ward no-23,538.1517.1546.,Construction of PCC Road and U/G drain in Anandpuri from Taralok to Bhusan Prasad house in ward no-23,458100.0,NIT NO-07/E/PATLIPUTRA /2022 Gr-71,2022-04-04,180,INR,,101,101,1557,1546,1,N,,7,03-04-2022,458100.0
21025,Construction of drain in Mirshikar Toli patli Gali in Ward no 54. under Urban Development Division Azimabad Patna,Construction of drain in Mirshikar Toli patli Gali in Ward no 54. under Urban Development Division Azimabad Patna,538.1517.1548.,Construction of drain in Mirshikar Toli patli Gali in Ward no 54. under Urban Development Division Azimabad Patna,708140.0,01/E/AZIMABAD/2022-23/GR 21,2022-04-21,120,INR,,101,101,1557,1548,1,N,,7,19-04-2022,708140.0
20884,NIT 13/2021-22/MID/kaimur/GR16,Renovation of Gauawan Ahar pyne,538.1420.1422.1425.1438.,NIT 13/2021-22/MID/kaimur/GR16,22703204.0,13/2021-22/MID/Kaimur/Gr16,2022-04-13,120,INR,,101,101,1557,1438,2,N,,7,13-04-2022,22703204.0
21561,"CONSTRUCTION OF P.C.C ROAD AND U.G. DRAIN WORK FROM SUDHIR THAKUR 
HOUSE TO SUNIL KUMAR HOUSE Under ward No-55 PMC, Patna.","CONSTRUCTION OF P.C.C ROAD AND U.G. DRAIN WORK FROM SUDHIR THAKUR 
HOUSE TO SUNIL KUMAR HOUSE Under ward No-55 PMC, Patna.",538.1517.1545.,"CONSTRUCTION OF P.C.C ROAD AND U.G. DRAIN WORK FROM SUDHIR THAKUR 
HOUSE TO SUNIL KUMAR HOUSE Under ward No-55 PMC, Patna.",586500.0,"01/E/KAN/2022-23, Group No.-42",2022-04-28,180,INR,,101,101,1557,1545,1,N,,7,28-04-2022,586500.0
20652,Construction of PCC Road in Purvi Nagar from Arun Pandey ji house to Indu Thakur house in ward no-02,Construction of PCC Road in Purvi Nagar from Arun Pandey ji house to Indu Thakur house in ward no-02,538.1517.1546.,Construction of PCC Road in Purvi Nagar from Arun Pandey ji house to Indu Thakur house in ward no-02,342800.0,NIT NO-07/E/PATLIPUTRA /2022 Gr-28,2022-04-04,180,INR,,101,101,1557,1546,1,N,,7,02-04-2022,342800.0
21135,Construction of Community Building in Hazari Mohalla in ward no-63 under Urban Development Division PMC Patna.,Construction of Community Building in Hazari Mohalla in ward no-63 under Urban Development Division PMC Patna.,538.1517.1548.,Construction of Community Building in Hazari Mohalla in ward no-63 under Urban Development Division PMC Patna.,2049639.0,01/E/AZIMABAD/2022-23/GR 56,2022-04-21,120,INR,,101,101,1557,1548,1,N,,6,21-04-2022,2049639.0
20660,Construction of PCC Road and U/G drain in Shivpuri Road No-0 Prum Arjun K.D. Tower Apartement to Shshil kumar house in ward no-07,Construction of PCC Road and U/G drain in Shivpuri Road No-0 Prum Arjun K.D. Tower Apartement to Shshil kumar house in ward no-07,538.1517.1546.,Construction of PCC Road and U/G drain in Shivpuri Road No-0 Prum Arjun K.D. Tower Apartement to Shshil kumar house in ward no-07,424000.0,NIT NO-07/E/PATLIPUTRA /2022 Gr-36,2022-04-04,180,INR,,101,101,1557,1546,1,N,,7,02-04-2022,424000.0
20955,"Construction of High Yield Tube well in Nand Gaon, Near Gandhi Murti at Ward No. 08.","Construction of High Yield Tube well in Nand Gaon, Near Gandhi Murti at Ward No. 08.",538.1517.1549.,"Construction of High Yield Tube well in Nand Gaon, Near Gandhi Murti at Ward No. 08.",9709500.0,04/E/WSD/2022/PMC/03,2022-04-19,120,INR,,101,101,1557,1549,2,N,,7,16-04-2022,9709500.0
21180,NAGAR PARISHAD WARD 04 ME NIFIKIR KE GALI SE AVM KAISH KHAN KE GALI KALIM KHAN KE GALI TEJMUL KE GALI NESAT KE GALI SEJAJUDDIN KE GALI NALA AVM SLAB KARYA PADAV KE GATE SE ISTEKHAR AHMED KE GHAR HOTE HUE ASLAM KHAN KE GHAR TAK MITTI BHARAI INTT SOLING PCC NIRMAN KARYA AVM MERAJ KHAN KE GHAR MUJIBU RAHMAN KE GHAR TAK MITTI BHARAI PCC NIRMAN KARYA,NAGAR PARISHAD WARD 04 ME NIFIKIR KE GALI SE AVM KAISH KHAN KE GALI KALIM KHAN KE GALI TEJMUL KE GALI NESAT KE GALI SEJAJUDDIN KE GALI NALA AVM SLAB KARYA PADAV KE GATE SE ISTEKHAR AHMED KE GHAR HOTE HUE ASLAM KHAN KE GHAR TAK MITTI BHARAI INTT SOLING PCC NIRMAN KARYA AVM MERAJ KHAN KE GHAR MUJIBU RAHMAN KE GHAR TAK MITTI BHARAI PCC NIRMAN KARYA,538.800.1991.,NAGAR PARISHAD WARD 04 ME NIFIKIR KE GALI SE AVM KAISH KHAN KE GALI KALIM KHAN KE GALI TEJMUL KE GALI NESAT KE GALI SEJAJUDDIN KE GALI NALA AVM SLAB KARYA PADAV KE GATE SE ISTEKHAR AHMED KE GHAR HOTE HUE ASLAM KHAN KE GHAR TAK MITTI BHARAI INTT SOLING PCC NIRMAN KARYA AVM MERAJ KHAN KE GHAR MUJIBU RAHMAN KE GHAR TAK MITTI BHARAI PCC NIRMAN KARYA,1575800.0,04/2021-22 GR03,2022-04-24,180,INR,,101,101,1557,1991,1,N,,7,24-04-2022,1575800.0
20709,Construction of PCC Road and Raising of Manhole in Arunima Apt. to Royal  Enclave in ward no-25,Construction of PCC Road and Raising of Manhole in Arunima Apt. to Royal  Enclave in ward no-25,538.1517.1546.,Construction of PCC Road and Raising of Manhole in Arunima Apt. to Royal  Enclave in ward no-25,1854502.0,NIT NO-07/E/PATLIPUTRA /2022 Gr-73,2022-04-04,180,INR,,101,101,1557,1546,1,N,,6,03-04-2022,1854502.0
21548,"ESTIM ATE OF CONSTRUCTION OF PCC ROAD WORK FROM 
LAL JI SHAH TO KABARI SHOP IN SANJAY GANDHI NAGAR UNDER WARD NO45 OF PMC PATNA.","ESTIM ATE OF CONSTRUCTION OF PCC ROAD WORK FROM 
LAL JI SHAH TO KABARI SHOP IN SANJAY GANDHI NAGAR UNDER WARD NO45 OF PMC PATNA.",538.1517.1545.,"ESTIM ATE OF CONSTRUCTION OF PCC ROAD WORK FROM 
LAL JI SHAH TO KABARI SHOP IN SANJAY GANDHI NAGAR UNDER WARD NO45 OF PMC PATNA.",485900.0,"01/E/KAN/2022-23, Group No.-30(I)",2022-04-28,180,INR,,101,101,1557,1545,1,N,,7,28-04-2022,485900.0
20624,Construction of U/G drain from H/o Dr. Kamlesh kumar to Parshant to Upandhaya Ji Back of St. Luis School to Parshant Upandhaya ji house in ward no-08,Construction of U/G drain from H/o Dr. Kamlesh kumar to Parshant to Upandhaya Ji Back of St. Luis School to Parshant Upandhaya ji house in ward no-08,538.1517.1546.,Construction of U/G drain from H/o Dr. Kamlesh kumar to Parshant to Upandhaya Ji Back of St. Luis School to Parshant Upandhaya ji house in ward no-08,317332.0,NIT NO-07/E/PATLIPUTRA /2022 Gr-03,2022-04-04,180,INR,,101,101,1557,1546,1,N,,7,02-04-2022,317332.0
20830,NIT NO 14/2021-22/MID/ROHTAS/GR10,RENOVATION OF MADAINI-02 AHAR,538.1420.1422.1425.1437.,NIT NO 14/2021-22/MID/ROHTAS/GR10,4949945.0,14/2021-22/MID/ROHTAS SASARAM/10,2022-04-12,120,INR,,101,101,1557,1437,2,N,,7,12-04-2022,4949945.0
21236,"Supply & Installation 04 Clock Chouk Tower Gaya and Maintains 03 Year under Gaya Municipal Corporation, Gaya","Supply & Installation 04 Clock Chouk Tower Gaya and Maintains 03 Year under Gaya Municipal Corporation, Gaya",538.800.888.,"Supply & Installation 04 Clock Chouk Tower Gaya and Maintains 03 Year under Gaya Municipal Corporation, Gaya",0.0,NIT-01/2022-23/GR01,2022-04-25,120,INR,,102,101,1554,888,2,N,,6,25-04-2022,0.0
21070,"Construction of Har Ghar Nal ka jal Yojana Remaning 290 House Hold Water Supply and Extenstion of pipe line work from Budico pipe line in Ward No-05, 06, 07 and 08","Construction of Har Ghar Nal ka jal Yojana Remaning 290 House Hold Water Supply and Extenstion of pipe line work from Budico pipe line in Ward No-05, 06, 07 and 08",538.800.826.,"Construction of Har Ghar Nal ka jal Yojana Remaning 290 House Hold Water Supply and Extenstion of pipe line work from Budico pipe line in Ward No-05, 06, 07 and 08",2864563.0,NPS-NIT-01/2022-23-GR-03,2022-04-19,120,INR,,101,101,1557,826,1,N,,7,19-04-2022,2864563.0
20708,Construction of PCC Road and U/G drain in Anandpuri from Bhushan Prasad house to Sri Ram Pandey houe in ward no-23,Construction of PCC Road and U/G drain in Anandpuri from Bhushan Prasad house to Sri Ram Pandey houe in ward no-23,538.1517.1546.,Construction of PCC Road and U/G drain in Anandpuri from Bhushan Prasad house to Sri Ram Pandey houe in ward no-23,464800.0,NIT NO-07/E/PATLIPUTRA /2022 Gr-72,2022-04-04,180,INR,,101,101,1557,1546,1,N,,7,03-04-2022,464800.0
21110,Construction of P.C.C Road & R.C.C drain in Mittan Ghat Adarsh colony -03 in ward no-59 under Urban development division Azimabad PMC Patna.,Construction of P.C.C Road & R.C.C drain in Mittan Ghat Adarsh colony -03 in ward no-59 under Urban development division Azimabad PMC Patna.,538.1517.1548.,Construction of P.C.C Road & R.C.C drain in Mittan Ghat Adarsh colony -03 in ward no-59 under Urban development division Azimabad PMC Patna.,973370.0,01/E/AZIMABAD/2022-23/GR 33,2022-04-21,120,INR,,101,101,1557,1548,1,N,,7,20-04-2022,973370.0
20792,Extensive Renovation of Hinduni Ahar /Pyne Scheme Under Minor Irrigation Division Patna (Gr 05),Extensive Renovation of Hinduni Ahar /Pyne Scheme Under Minor Irrigation Division Patna (Gr 05),538.1420.1422.1425.1434.,Extensive Renovation of Hinduni Ahar /Pyne Scheme Under Minor Irrigation Division Patna (Gr 05),17573518.0,RE02/2021-22/MID/PATNA/01,2022-04-10,120,INR,,101,101,1557,1434,2,N,,7,10-04-2022,17573518.0
20654,Construction of U/G drain in Anand Vihar Colony Near of Kalyan Vihar Colony from Surendra Pd. Verma house to Surendra pd. House in ward no-02,Construction of U/G drain in Anand Vihar Colony Near of Kalyan Vihar Colony from Surendra Pd. Verma house to Surendra pd. House in ward no-02,538.1517.1546.,Construction of U/G drain in Anand Vihar Colony Near of Kalyan Vihar Colony from Surendra Pd. Verma house to Surendra pd. House in ward no-02,872100.0,NIT NO-07/E/PATLIPUTRA /2022 Gr-30,2022-04-04,180,INR,,101,101,1557,1546,1,N,,7,02-04-2022,872100.0
21201,NAGAR PARISHAD WARD 05 ME MADRASA SE MAHTAB KHAN KE GHAR TAK AVM SHAUKAT KE GHAR SE HEJARU KHAN KE GHAR HOTE HUE PAINUL KHAN KE GHAR SE MAIN NALA TAK PCC PATH AVM NALA NIRMAN KARYA,NAGAR PARISHAD WARD 05 ME MADRASA SE MAHTAB KHAN KE GHAR TAK AVM SHAUKAT KE GHAR SE HEJARU KHAN KE GHAR HOTE HUE PAINUL KHAN KE GHAR SE MAIN NALA TAK PCC PATH AVM NALA NIRMAN KARYA,538.800.1991.,NAGAR PARISHAD WARD 05 ME MADRASA SE MAHTAB KHAN KE GHAR TAK AVM SHAUKAT KE GHAR SE HEJARU KHAN KE GHAR HOTE HUE PAINUL KHAN KE GHAR SE MAIN NALA TAK PCC PATH AVM NALA NIRMAN KARYA,1213400.0,04/2021-22 GR22,2022-04-24,180,INR,,101,101,1557,1991,1,N,,7,24-04-2022,1213400.0
21551,"ESTIM ATE OF CONSTRUCTION OF U/G DRAIN AND PCC 
ROAD WORK IN CHITRAGUPTA NAGAR ROAD NO- 2 UNDER WARD NO-45 OF 
PMC PATNA.","ESTIM ATE OF CONSTRUCTION OF U/G DRAIN AND PCC 
ROAD WORK IN CHITRAGUPTA NAGAR ROAD NO- 2 UNDER WARD NO-45 OF 
PMC PATNA.",538.1517.1545.,"ESTIM ATE OF CONSTRUCTION OF U/G DRAIN AND PCC 
ROAD WORK IN CHITRAGUPTA NAGAR ROAD NO- 2 UNDER WARD NO-45 OF 
PMC PATNA.",1074300.0,"01/E/KAN/2022-23, Group No.-33",2022-04-28,180,INR,,101,101,1557,1545,1,N,,7,28-04-2022,1074300.0
20846,Renovation of Burhwa Ahar Pond  Scheme,Renovation of Burhwa Ahar Pond  Scheme,538.1420.1422.1426.1441.,Renovation of Burhwa Ahar Pond  Scheme,25028254.0,13/2021-22/ GP-03,2022-04-12,120,INR,,101,101,1557,1441,2,N,,7,12-04-2022,25028254.0
19291,Remains construction work of Administrative Training Institute under Gaya district. (including electrification and fire fighting work).,Remains construction work of Administrative Training Institute under Gaya district. (including electrification and fire fighting work).,538.1026.1095.1185.1186.,Remains construction work of Administrative Training Institute under Gaya district. (including electrification and fire fighting work).,538577533.0,NIT 01/BCD/GAYA/2022-23,2022-04-07,120,INR,,101,101,1557,1186,2,N,,6,21-02-2022,538577533.0
21576,"CONSTRUCTION OF U/G DRAIN & P.C.C ROAD FROM 
SANTOSH PRAKASH JI TO SUNITA SADAN IN NALANDA COLONY. UNDER 
WARD NO-55 OF PMC, PATNA.","CONSTRUCTION OF U/G DRAIN & P.C.C ROAD FROM 
SANTOSH PRAKASH JI TO SUNITA SADAN IN NALANDA COLONY. UNDER 
WARD NO-55 OF PMC, PATNA.",538.1517.1545.,"CONSTRUCTION OF U/G DRAIN & P.C.C ROAD FROM 
SANTOSH PRAKASH JI TO SUNITA SADAN IN NALANDA COLONY. UNDER 
WARD NO-55 OF PMC, PATNA.",1008000.0,"03/E/KAN/2022-23, Group No.-04",2022-04-28,180,INR,,101,101,1557,1545,1,N,,7,28-04-2022,1008000.0
21033,Construction of PCC road in South Colony of Gulzarbagh Station in ward no-57 under Urban Development Division Azimabad PMC Patna.,Construction of PCC road in South Colony of Gulzarbagh Station in ward no-57 under Urban Development Division Azimabad PMC Patna.,538.1517.1548.,Construction of PCC road in South Colony of Gulzarbagh Station in ward no-57 under Urban Development Division Azimabad PMC Patna.,516619.0,01/E/AZIMABAD/2022-23/GR 28,2022-04-21,120,INR,,101,101,1557,1548,1,N,,7,19-04-2022,516619.0
20991,Construction of Boundary wall of Prem Vatika Ambedkar Park at Arfabad Colony in Ward no 54. under Urban Development Division Azimabad Patna,Construction of Boundary wall of Prem Vatika Ambedkar Park at Arfabad Colony in Ward no 54. under Urban Development Division Azimabad Patna,538.1517.1548.,Construction of Boundary wall of Prem Vatika Ambedkar Park at Arfabad Colony in Ward no 54. under Urban Development Division Azimabad Patna,1032290.0,01/E/AZIMABAD/2022-23/GR 09,2022-04-21,120,INR,,101,101,1557,1548,1,N,,6,18-04-2022,1032290.0
20680,Construction of PCC Road and U/G drain I Anand Puri form S.N. Pandey house to Radhe Raman Sing house in ward no-23,Construction of PCC Road and U/G drain I Anand Puri form S.N. Pandey house to Radhe Raman Sing house in ward no-23,538.1517.1546.,Construction of PCC Road and U/G drain I Anand Puri form S.N. Pandey house to Radhe Raman Sing house in ward no-23,441800.0,NIT NO-07/E/PATLIPUTRA /2022 Gr-56,2022-04-04,180,INR,,101,101,1557,1546,1,N,,7,02-04-2022,441800.0
20889,"Construction of P.C.C Road from Jail main gate to residential Quarters in District Jail Campus, Begusarai","Construction of P.C.C Road from Jail main gate to residential Quarters in District Jail Campus, Begusarai",538.1026.1096.1206.1208.,"Construction of P.C.C Road from Jail main gate to residential Quarters in District Jail Campus, Begusarai",3793165.0,E-NIT-23/BEGUSARAI/2021-22,2022-04-13,120,INR,,101,101,1557,1208,1,N,,7,13-04-2022,3793165.0
20640,Construction of PCC Road & U/G drain from Rajeshwar Pd. to Samrendra Prasad Near Lalbabu Market in ward no-08,Construction of PCC Road & U/G drain from Rajeshwar Pd. to Samrendra Prasad Near Lalbabu Market in ward no-08,538.1517.1546.,Construction of PCC Road & U/G drain from Rajeshwar Pd. to Samrendra Prasad Near Lalbabu Market in ward no-08,707128.0,NIT NO-07/E/PATLIPUTRA /2022 Gr-16,2022-04-04,180,INR,,101,101,1557,1546,1,N,,7,02-04-2022,707128.0
21558,"- ESTIM ATE OF VILLAGE ENTRY GATE IN DAUD VIGHA KANKARBHAGH 
PATNA UNDER WARD NO-55 OF PMC PATNA.","- ESTIM ATE OF VILLAGE ENTRY GATE IN DAUD VIGHA KANKARBHAGH 
PATNA UNDER WARD NO-55 OF PMC PATNA.",538.1517.1545.,"- ESTIM ATE OF VILLAGE ENTRY GATE IN DAUD VIGHA KANKARBHAGH 
PATNA UNDER WARD NO-55 OF PMC PATNA.",712200.0,"01/E/KAN/2022-23, Group No.-39",2022-04-28,180,INR,,101,101,1557,1545,1,N,,7,28-04-2022,712200.0
20734,Construction of PCC Road & U/G Drain in Ghunddaur Road No.- Shyam Narayan House to Mahesh Ray House. in ward no-01,Construction of PCC Road & U/G Drain in Ghunddaur Road No.- Shyam Narayan House to Mahesh Ray House. in ward no-01,538.1517.1546.,Construction of PCC Road & U/G Drain in Ghunddaur Road No.- Shyam Narayan House to Mahesh Ray House. in ward no-01,3139100.0,NIT NO-07/E/PATLIPUTRA /2022 Gr-97,2022-04-04,180,INR,,101,101,1557,1546,1,N,,6,04-04-2022,3139100.0
21037,Construction of District Women Empowerment office Building at Katihar in Katihar District.,Construction of District Women Empowerment office Building at Katihar in Katihar District.,538.1026.1096.1219.1221.,Construction of District Women Empowerment office Building at Katihar in Katihar District.,2869393.0,02/ET/BCD/KATIHAR/2022-23,2022-04-19,120,INR,,101,101,1557,1221,1,N,,7,19-04-2022,2869393.0
20888,"Constraction of  Repaire drain from Main path to west side Purnia Gola chowk to near south Muskan Marval, near Jhallu house, near dalit Basti, near Citi kart, near  Vipin yadav house  under Nagar parishad Madhepura. during year 2021-22","Constraction of  Repaire drain from Main path to west side Purnia Gola chowk to near south Muskan Marval, near Jhallu house, near dalit Basti, near Citi kart, near  Vipin yadav house  under Nagar parishad Madhepura. during year 2021-22",538.800.896.,"Constraction of  Repaire drain from Main path to west side Purnia Gola chowk to near south Muskan Marval, near Jhallu house, near dalit Basti, near Citi kart, near  Vipin yadav house  under Nagar parishad Madhepura. during year 2021-22",551300.0,GR13/NIT14/NP MADHEPURA,2022-04-13,90,INR,,101,101,1557,896,1,N,,7,13-04-2022,551300.0
21024,Construction of PCC in Shankar Colony in Ward no 54. under Urban Development Division Azimabad Patna,Construction of PCC in Shankar Colony in Ward no 54. under Urban Development Division Azimabad Patna,538.1517.1548.,Construction of PCC in Shankar Colony in Ward no 54. under Urban Development Division Azimabad Patna,138292.0,01/E/AZIMABAD/2022-23/GR 20,2022-04-21,120,INR,,101,101,1557,1548,1,N,,7,19-04-2022,138292.0
21010,"S/R of AFS Gate of Rasalpur 533 Rd at Lower noon left embank?Ahamadpur558RD, Khanannala 578RD at Lower noon right embank, Chandrahasdih 0RD, Lagama 3RD, Darva 11RD at khaimait jhil link channel left embambank? Lagama 3RD at khaimait jhil link channel right embambank?","S/R of AFS Gate of Rasalpur 533 Rd at Lower noon left embank?Ahamadpur558RD, Khanannala 578RD at Lower noon right embank, Chandrahasdih 0RD, Lagama 3RD, Darva 11RD at khaimait jhil link channel left embambank? Lagama 3RD at khaimait jhil link channel right embambank?",538.731.1051.1056.,"S/R of AFS Gate of Rasalpur 533 Rd at Lower noon left embank?Ahamadpur558RD, Khanannala 578RD at Lower noon right embank, Chandrahasdih 0RD, Lagama 3RD, Darva 11RD at khaimait jhil link channel left embambank? Lagama 3RD at khaimait jhil link channel right embambank?",5191226.0,03/2022-23-GR-01/IMD/SAMASTIPUR,2022-04-19,120,INR,,101,101,1556,1056,2,N,,6,18-04-2022,5191226.0
21543,"ESTIM ATE OF ESTIM ATE FOR CONSTRUCTION OF UNDER 
GROUND DRAIN AND PCC ROAD FROM L.I.G BLOCK 13 TO VIVEK VIHAR MORE 
AT HANUMAN NAGAR UNDER WARD NO-45 OF PMC PATNA.","ESTIM ATE OF ESTIM ATE FOR CONSTRUCTION OF UNDER 
GROUND DRAIN AND PCC ROAD FROM L.I.G BLOCK 13 TO VIVEK VIHAR MORE 
AT HANUMAN NAGAR UNDER WARD NO-45 OF PMC PATNA.",538.1517.1545.,"ESTIM ATE OF ESTIM ATE FOR CONSTRUCTION OF UNDER 
GROUND DRAIN AND PCC ROAD FROM L.I.G BLOCK 13 TO VIVEK VIHAR MORE 
AT HANUMAN NAGAR UNDER WARD NO-45 OF PMC PATNA.",594900.0,"01/E/KAN/2022-23, Group No.-27",2022-04-28,180,INR,,101,101,1557,1545,1,N,,7,28-04-2022,594900.0
20679,Construction of PCC Road and U/G drain in Monteshri Gali from Ajay kumar house to Transformer in ward no-23,Construction of PCC Road and U/G drain in Monteshri Gali from Ajay kumar house to Transformer in ward no-23,538.1517.1546.,Construction of PCC Road and U/G drain in Monteshri Gali from Ajay kumar house to Transformer in ward no-23,445100.0,NIT NO-07/E/PATLIPUTRA /2022 Gr-55,2022-04-04,180,INR,,101,101,1557,1546,1,N,,7,02-04-2022,445100.0
20960,"Laying HDPE pipe line and house to house connection in Mundar Sah Colony, Sector-04 to Gandhi Nagar, Ramnagri, Sector-03 to Cement Dukan to Pamview Hospital to State Bank Colony at Ward No. 02.","Laying HDPE pipe line and house to house connection in Mundar Sah Colony, Sector-04 to Gandhi Nagar, Ramnagri, Sector-03 to Cement Dukan to Pamview Hospital to State Bank Colony at Ward No. 02.",538.1517.1549.,"Laying HDPE pipe line and house to house connection in Mundar Sah Colony, Sector-04 to Gandhi Nagar, Ramnagri, Sector-03 to Cement Dukan to Pamview Hospital to State Bank Colony at Ward No. 02.",8210791.0,04/E/WSD/2022/PMC/08,2022-04-19,120,INR,,101,101,1557,1549,2,N,,7,16-04-2022,8210791.0
20826,"ANTI EROSION WORK FOR PROTECTION OF SEMRAHIYAN NADI TOLA, SEDHA TOLA AND CHITHAN NADI TOLA VILLAGE AT RIGHT BANK OF TILAWE RIVER VILLAGE.
Agenda no- 180/91/2022
Group no-1","ANTI EROSION WORK FOR PROTECTION OF SEMRAHIYAN NADI TOLA, SEDHA TOLA AND CHITHAN NADI TOLA VILLAGE AT RIGHT BANK OF TILAWE RIVER VILLAGE.
Agenda no- 180/91/2022
Group no-1",538.731.972.1044.,"ANTI EROSION WORK FOR PROTECTION OF SEMRAHIYAN NADI TOLA, SEDHA TOLA AND CHITHAN NADI TOLA VILLAGE AT RIGHT BANK OF TILAWE RIVER VILLAGE.
Agenda no- 180/91/2022
Group no-1",4453769.0,NIT01/2022-23/ EE DD MOTIHARI/ WRD /GR-01,2022-04-12,120,INR,,101,101,1557,1044,2,N,,7,12-04-2022,4453769.0
20745,"Construction of 125 mm x 40 mm x 46 M deep tube well ( 21 Nos.) and 125 mm x 45 M GPT (11 Nos.) with I.M. II Hand Pump, Platform & drain in Habitations(SC). Under IMIS of Jal Shakti Under Special Central Assistance to Schedule caste sub Plan (SCA to SCSP) for the Year 2021-22 under P. H. Division, Biharsharif","Construction of 125 mm x 40 mm x 46 M deep tube well ( 21 Nos.) and 125 mm x 45 M GPT (11 Nos.) with I.M. II Hand Pump, Platform & drain in Habitations(SC). Under IMIS of Jal Shakti Under Special Central Assistance to Schedule caste sub Plan (SCA to SCSP) for the Year 2021-22 under P. H. Division, Biharsharif",538.790.999.1000.1003.,"Construction of 125 mm x 40 mm x 46 M deep tube well ( 21 Nos.) and 125 mm x 45 M GPT (11 Nos.) with I.M. II Hand Pump, Platform & drain in Habitations(SC). Under IMIS of Jal Shakti Under Special Central Assistance to Schedule caste sub Plan (SCA to SCSP) for the Year 2021-22 under P. H. Division, Biharsharif",2001304.0,NIT-11/2021-22/BIHARSHARIF Gr.01,2022-04-04,180,INR,,101,101,1557,1003,2,N,,7,04-04-2022,2001304.0
20738,NIT NO. 04/2021-2022,"Renovation of Dhankutwa-1, Narkatiya-1 & Narkatiya-2 Lift Irrigation Scheme, Under Block Sikta, West Champaran.",538.1420.1423.1427.1449.,NIT NO. 04/2021-2022,8623800.0,07,2022-04-04,120,INR,,101,101,1557,1449,2,N,,7,04-04-2022,8623800.0
21027,Construction of RCC Drain Matth Laxamanpur Badi Mathni From Kabristan to South Nahar in Ward no 54. under Urban Development Division Azimabad Patna,Construction of RCC Drain Matth Laxamanpur Badi Mathni From Kabristan to South Nahar in Ward no 54. under Urban Development Division Azimabad Patna,538.1517.1548.,Construction of RCC Drain Matth Laxamanpur Badi Mathni From Kabristan to South Nahar in Ward no 54. under Urban Development Division Azimabad Patna,287446.0,01/E/AZIMABAD/2022-23/GR 23,2022-04-21,120,INR,,101,101,1557,1548,1,N,,7,19-04-2022,287446.0
21085,"Construction of PCC Road, Brick work and drain from Indra Prasda market via kasim maiya house to shiv mandir path in ward no-08 under nagar parishad Barauli, Gopalganj.","Construction of PCC Road, Brick work and drain from Indra Prasda market via kasim maiya house to shiv mandir path in ward no-08 under nagar parishad Barauli, Gopalganj.",538.800.831.,"Construction of PCC Road, Brick work and drain from Indra Prasda market via kasim maiya house to shiv mandir path in ward no-08 under nagar parishad Barauli, Gopalganj.",742939.0,NIT NO-01/2022-23/BARAULI/GR-08,2022-04-20,120,INR,,101,101,1557,831,1,N,,7,20-04-2022,742939.0
20992,Construction of Drain patel colony gali no 05 in Ward no 54. under Urban Development Division Azimabad Patna,Construction of Drain patel colony gali no 05 in Ward no 54. under Urban Development Division Azimabad Patna,538.1517.1548.,Construction of Drain patel colony gali no 05 in Ward no 54. under Urban Development Division Azimabad Patna,477929.0,01/E/AZIMABAD/2022-23/GR 10,2022-04-21,120,INR,,101,101,1557,1548,1,N,,6,18-04-2022,477929.0
20920,ANTI EROSION WORK IN BETWEEN K.M. 64.00 TO K.M. 65.00 OF HAYAGHAT KARACHIN EMBANKMENT (RIGHT BANK) NEAR VILLAGE BHAGAUT BEFORE FLOOD 2022 (AGENDA NO. 185/09/2022) (GROUP-01),ANTI EROSION WORK IN BETWEEN K.M. 64.00 TO K.M. 65.00 OF HAYAGHAT KARACHIN EMBANKMENT (RIGHT BANK) NEAR VILLAGE BHAGAUT BEFORE FLOOD 2022 (AGENDA NO. 185/09/2022) (GROUP-01),538.731.877.921.,ANTI EROSION WORK IN BETWEEN K.M. 64.00 TO K.M. 65.00 OF HAYAGHAT KARACHIN EMBANKMENT (RIGHT BANK) NEAR VILLAGE BHAGAUT BEFORE FLOOD 2022 (AGENDA NO. 185/09/2022) (GROUP-01),11898257.0,01/2022-23/FCD/HATHAURI/01,2022-04-14,120,INR,,101,101,1557,921,2,N,,7,14-04-2022,11898257.0
20744,Construction of U/G drain & PCC Road From Siban house to AnRay Prayag Ram house in  Ward-22C,Construction of U/G drain & PCC Road From Siban house to AnRay Prayag Ram house in  Ward-22C,538.1517.1546.,Construction of U/G drain & PCC Road From Siban house to AnRay Prayag Ram house in  Ward-22C,315600.0,NIT NO-07/E/PATLIPUTRA /2022 Gr-106,2022-04-04,180,INR,,101,101,1557,1546,1,N,,7,04-04-2022,315600.0
21509,"Construction of 125mm x 40mm x 61 mtr deep 50 Nos. India Mark II Hand Pumps in Place of Old Defunct/Ordinary Handpump with Platform and Drain including Soakpit in Saran District under P.H.Division, Chapra  in the year 2022-23.","Construction of 125mm x 40mm x 61 mtr deep 50 Nos. India Mark II Hand Pumps in Place of Old Defunct/Ordinary Handpump with Platform and Drain including Soakpit in Saran District under P.H.Division, Chapra  in the year 2022-23.",538.790.791.1072.1079.,"Construction of 125mm x 40mm x 61 mtr deep 50 Nos. India Mark II Hand Pumps in Place of Old Defunct/Ordinary Handpump with Platform and Drain including Soakpit in Saran District under P.H.Division, Chapra  in the year 2022-23.",3163300.0,NIT-02/2022-23 (GR-02),2022-04-28,180,INR,,101,101,1557,1079,2,N,,7,27-04-2022,3163300.0
21005,"S/F/F/R OF  Surullabaha, Kolhatta, Jahangirpur, Mamurpur, Maraul(Bakhari) Hayaghat Karachin Right Embanlment?","S/F/F/R OF  Surullabaha, Kolhatta, Jahangirpur, Mamurpur, Maraul(Bakhari) Hayaghat Karachin Right Embanlment?",538.731.1051.1056.,"S/F/F/R OF  Surullabaha, Kolhatta, Jahangirpur, Mamurpur, Maraul(Bakhari) Hayaghat Karachin Right Embanlment?",1962425.0,02/2022-23-GR-02/IMD/SAMASTIPUR,2022-04-19,120,INR,,101,101,1556,1056,2,N,,7,18-04-2022,1962425.0
21503,Renovation work in Mandal Kara Jail Nawada at Dist Nawada.,Renovation work in Mandal Kara Jail Nawada at Dist Nawada.,538.1026.1095.1185.1188.,Renovation work in Mandal Kara Jail Nawada at Dist Nawada.,7903260.0,12/BCD/NAWADA/2021-22,2022-04-27,120,INR,,101,101,1557,1188,2,N,,7,27-04-2022,7903260.0
