18845,Construction of Drain from House of Tripurari Singh to Shiv Mandir,Construction of Drain from House of Tripurari Singh to Shiv Mandir,538.800.979.,Construction of Drain from House of Tripurari Singh to Shiv Mandir,2495000.0,NIT05NALIGALI,2022-02-10,180,INR,,101,101,1557,979,1,N,,7,10-02-2022,2495000.0
19301,"REPAIR AND MAINTENANCE OF ANTI FLOOD SLUICE GATE OF JHAUA BELGACHHI, SAURA EMBANKMENT, ARRAH BARI MAHANANDA LEFT EMBANKMENT AND GACHH PARA MAHANANDA LEFT EMBANKMENT BEFORE FLOOD 2022 (GROUP-01)","REPAIR AND MAINTENANCE OF ANTI FLOOD SLUICE GATE OF JHAUA BELGACHHI, SAURA EMBANKMENT, ARRAH BARI MAHANANDA LEFT EMBANKMENT AND GACHH PARA MAHANANDA LEFT EMBANKMENT BEFORE FLOOD 2022 (GROUP-01)",538.731.1051.1057.,"REPAIR AND MAINTENANCE OF ANTI FLOOD SLUICE GATE OF JHAUA BELGACHHI, SAURA EMBANKMENT, ARRAH BARI MAHANANDA LEFT EMBANKMENT AND GACHH PARA MAHANANDA LEFT EMBANKMENT BEFORE FLOOD 2022 (GROUP-01)",2425062.0,NIT: 03/2021-22/PURNEADIV/GR01,2022-02-22,120,INR,,101,101,1556,1057,2,N,,7,22-02-2022,2425062.0
19020,"EC Approved Sand Ghat of ROHTAS  (Cluster-04) 
MANGRAWAN SAND GHAT B ( MINEABLE QUANTITY- 7626960 CFT)","EC Approved Sand Ghat of ROHTAS  (Cluster-04) 
MANGRAWAN SAND GHAT B ( MINEABLE QUANTITY- 7626960 CFT)",538.2005.,"EC Approved Sand Ghat of ROHTAS  (Cluster-04) 
MANGRAWAN SAND GHAT B ( MINEABLE QUANTITY- 7626960 CFT)",65990508.0,BSMCL-09/2021-22/ROHTAS/CLUSTER-04,2022-02-15,180,INR,,102,121,1559,2005,1,N,,4,14-02-2022,65990508.0
18691,NIT 02/2021-22 Group 11,"Renovation of Bhinda Ahar, Pyne Scheme Under M.I. Division Nalanda",538.1420.1422.1425.1435.,NIT 02/2021-22 Group 11,5810389.0,"02/2021-22 MID, Nalanda Group 11",2022-02-06,120,INR,,101,101,1557,1435,2,N,,7,06-02-2022,5810389.0
18875,"DETAILED ESTIMATE FOR THE CONSTRUCTION OF PAVER ROAD AND R.C.C DRAIN FROM THE HOUSE OF SUCHITA KUMARI TO THE HOUSE OF DINESH DINKAR VIA THE HOUSE OF SANTOSH BABA IN KAMAL SHEKHAR MARG IN WARD NO-01 UNDER NAGAR PANCHAYAT, NIRMALI (SUPAUL)","DETAILED ESTIMATE FOR THE CONSTRUCTION OF PAVER ROAD AND R.C.C DRAIN FROM THE HOUSE OF SUCHITA KUMARI TO THE HOUSE OF DINESH DINKAR VIA THE HOUSE OF SANTOSH BABA IN KAMAL SHEKHAR MARG IN WARD NO-01 UNDER NAGAR PANCHAYAT, NIRMALI (SUPAUL)",538.800.1241.,"DETAILED ESTIMATE FOR THE CONSTRUCTION OF PAVER ROAD AND R.C.C DRAIN FROM THE HOUSE OF SUCHITA KUMARI TO THE HOUSE OF DINESH DINKAR VIA THE HOUSE OF SANTOSH BABA IN KAMAL SHEKHAR MARG IN WARD NO-01 UNDER NAGAR PANCHAYAT, NIRMALI (SUPAUL)",863300.0,NIT-06/2021-22/GR - 02/NIRMALI,2022-02-14,180,INR,,101,101,1557,1241,1,N,,7,11-02-2022,863300.0
18728,"Supplying and installation work of Furniture of Administrative block, 100 Beded (2units) Boy's hlostel and 100 Beded Girl's hostel in New Govt. Polytechnic College at Bettiah, West Champran.","Supplying and installation work of Furniture of Administrative block, 100 Beded (2units) Boy's hlostel and 100 Beded Girl's hostel in New Govt. Polytechnic College at Bettiah, West Champran.",538.1026.1096.1211.1214.,"Supplying and installation work of Furniture of Administrative block, 100 Beded (2units) Boy's hlostel and 100 Beded Girl's hostel in New Govt. Polytechnic College at Bettiah, West Champran.",37778000.0,22/BCD/BETTIAH/2021-22.,2022-02-08,120,INR,,101,101,1554,1214,2,N,,7,08-02-2022,37778000.0
19099,"Construction of  P.C.C. Road with R.C.C. Drain from Punendra Singh House to Ram Nandan Prasad House in Ward No.-01 under MMC, Muzaffarpur. GROUP-01","Construction of  P.C.C. Road with R.C.C. Drain from Punendra Singh House to Ram Nandan Prasad House in Ward No.-01 under MMC, Muzaffarpur. GROUP-01",538.800.892.,"Construction of  P.C.C. Road with R.C.C. Drain from Punendra Singh House to Ram Nandan Prasad House in Ward No.-01 under MMC, Muzaffarpur. GROUP-01",4978114.0,NIT-17/MMC/MUZAFFARPUR/2021-22/GR-01,2022-02-15,180,INR,,101,101,1557,892,1,N,,7,15-02-2022,4978114.0
19043,"EC Approved Sandghats of GAYA (Cluster- 62)
KAREA SAND GHAT (Mineable Quantity -7284238CFT)","EC Approved Sandghats of GAYA (Cluster- 62)
KAREA SAND GHAT (Mineable Quantity -7284238CFT)",538.2005.,"EC Approved Sandghats of GAYA (Cluster- 62)
KAREA SAND GHAT (Mineable Quantity -7284238CFT)",8114655.0,BSMCL-09/2021-22/Gaya/CLUSTER- 62,2022-02-15,180,INR,,102,121,1559,2005,1,N,,4,15-02-2022,8114655.0
19612,Construction of rcc drain with cover in south side naya tola NH 98 in khadim khan to house shafique miyan in ward no 21 under nagar parishad phulwari sharif,Construction of rcc drain with cover in south side naya tola NH 98 in khadim khan to house shafique miyan in ward no 21 under nagar parishad phulwari sharif,538.800.823.,Construction of rcc drain with cover in south side naya tola NH 98 in khadim khan to house shafique miyan in ward no 21 under nagar parishad phulwari sharif,2496783.0,NIT12/2021-22/GR-53,2022-02-28,180,INR,,101,101,1557,823,1,N,,7,28-02-2022,2496783.0
19298,NIT No.-06/2021-22/MWRD BHAGALPUR/Gr-20,RENOVATION WORK OF  CHAKANDRA PYNE,538.1420.1424.1431.1460.,NIT No.-06/2021-22/MWRD BHAGALPUR/Gr-20,3950006.06,NIT No.-06/2021-22/MWRD BHAGALPUR/Gr-20,2022-02-22,120,INR,,101,101,1557,1460,2,N,,7,22-02-2022,3950006.06
18771,"construction of r.c.c drain  work from Janta vastralay to prakash towkij chowk via house of bajrang bajaj , super market in ward no-07 , under nagar parishad khagaria for the year of 2020-21.","construction of r.c.c drain  work from Janta vastralay to prakash towkij chowk via house of bajrang bajaj , super market in ward no-07 , under nagar parishad khagaria for the year of 2020-21.",538.800.895.,"construction of r.c.c drain  work from Janta vastralay to prakash towkij chowk via house of bajrang bajaj , super market in ward no-07 , under nagar parishad khagaria for the year of 2020-21.",2259946.0,NIT 10/2021-22 KHG G.No-09,2022-02-10,120,INR,,101,101,1557,895,1,N,,7,09-02-2022,2259946.0
19194,Ward no-12 me Dr. Ansari ke makan se kut Factory tak path ka nirman.,Ward no-12 me Dr. Ansari ke makan se kut Factory tak path ka nirman.,538.800.1406.,Ward no-12 me Dr. Ansari ke makan se kut Factory tak path ka nirman.,1125700.0,Re Tender NIT NO. -11/2021 GR-04,2022-02-16,120,INR,,101,101,1557,1406,1,N,,7,16-02-2022,1125700.0
19117,"Construction of P.C.C. road with drain from the house of Umesh Mishra to the Railway Line road  at Ward  No.-26 & 27, Under Nagar Parishad, Benipur.","Construction of P.C.C. road with drain from the house of Umesh Mishra to the Railway Line road  at Ward  No.-26 & 27, Under Nagar Parishad, Benipur.",538.800.890.,"Construction of P.C.C. road with drain from the house of Umesh Mishra to the Railway Line road  at Ward  No.-26 & 27, Under Nagar Parishad, Benipur.",2015800.0,BMC-NIT-02/2021-22/GR-48,2022-02-15,90,INR,,101,101,1557,890,1,N,,7,15-02-2022,2015800.0
18763,"Detailed estimate for construction of p.c.c road work  at Dan nagr  Over head tank to Bhakhari bus stand in ward no-1, under nagar parishad khagaria for the year of 2021-22.","Detailed estimate for construction of p.c.c road work  at Dan nagr  Over head tank to Bhakhari bus stand in ward no-1, under nagar parishad khagaria for the year of 2021-22.",538.800.895.,"Detailed estimate for construction of p.c.c road work  at Dan nagr  Over head tank to Bhakhari bus stand in ward no-1, under nagar parishad khagaria for the year of 2021-22.",1273750.0,NIT 10/2021-22 KHG G.No-01,2022-02-10,120,INR,,101,101,1557,895,1,N,,7,09-02-2022,1273750.0
19195,Ward no-27 me mahalla Gardharpar Rajkumar ke ghar se Santosh kumar tak pakar per ke pas avam Baradari mor kabristan se Ajay kumar ke ghar tak nala avam path nirman.,Ward no-27 me mahalla Gardharpar Rajkumar ke ghar se Santosh kumar tak pakar per ke pas avam Baradari mor kabristan se Ajay kumar ke ghar tak nala avam path nirman.,538.800.1406.,Ward no-27 me mahalla Gardharpar Rajkumar ke ghar se Santosh kumar tak pakar per ke pas avam Baradari mor kabristan se Ajay kumar ke ghar tak nala avam path nirman.,984700.0,Re Tender NIT NO. -11/2021 GR-05,2022-02-16,120,INR,,101,101,1557,1406,1,N,,7,16-02-2022,984700.0
18653,Construction of Water supply scheme (500 H.H) in ward no 09 at Nagar Parishad Forbesganj.,Construction of Water supply scheme (500 H.H) in ward no 09 at Nagar Parishad Forbesganj.,538.800.818.,Construction of Water supply scheme (500 H.H) in ward no 09 at Nagar Parishad Forbesganj.,7368630.0,NPFORBESGANJ/RE-TENDAR-NO-13/2021-22/GR-03,2022-02-03,120,INR,,102,101,1557,818,2,N,,7,02-02-2022,7368630.0
19381,Construction of Soil Soling & PCC Work From NH 107  North Balram Jaiswal House to..................Mishra Tola  in Ward no- 33.(Detail as per NIT),Construction of Soil Soling & PCC Work From NH 107  North Balram Jaiswal House to..................Mishra Tola  in Ward no- 33.(Detail as per NIT),538.800.825.,Construction of Soil Soling & PCC Work From NH 107  North Balram Jaiswal House to..................Mishra Tola  in Ward no- 33.(Detail as per NIT),340100.0,NP/SHC/NIT04/2021-22/Gr-54,2022-02-23,120,INR,,101,101,1557,825,1,N,,7,23-02-2022,340100.0
18692,NIT 02/2021-22 Group 12,"Renovation of Nawada, Kakan, Kanahaiyaganj Ahar Pyne Scheme Under M.I. Division Nalanda",538.1420.1422.1425.1435.,NIT 02/2021-22 Group 12,10169933.0,"02/2021-22 MID, Nalanda Group 12",2022-02-06,120,INR,,101,101,1557,1435,2,N,,7,06-02-2022,10169933.0
19626,Construction of P.C.C  Road & R.C.C Drain in Construction of P.C.C road and R.C.C Drain in Badi patan Devi from of surendra prasad house to the house of Mahesh ji Ward no. 58 under Azimabad Division PMC Patna.,Construction of P.C.C  Road & R.C.C Drain in Construction of P.C.C road and R.C.C Drain in Badi patan Devi from of surendra prasad house to the house of Mahesh ji Ward no. 58 under Azimabad Division PMC Patna.,538.1517.1548.,Construction of P.C.C  Road & R.C.C Drain in Construction of P.C.C road and R.C.C Drain in Badi patan Devi from of surendra prasad house to the house of Mahesh ji Ward no. 58 under Azimabad Division PMC Patna.,167213.0,NIT-15/E/AZIMABAD/2021-22_GR01,2022-02-28,120,INR,,101,101,1557,1548,1,N,,7,28-02-2022,167213.0
19445,"supplying fabrication & erection of new gates embeded ,hoisting arrangment ,hoisting bridge ,Approch ladder&civil work at BHARTPUR SINGHARA MAHUA In BAYA river under water drainge division Hajipur.","supplying fabrication & erection of new gates embeded ,hoisting arrangment ,hoisting bridge ,Approch ladder&civil work at BHARTPUR SINGHARA MAHUA In BAYA river under water drainge division Hajipur.",538.731.1051.1056.,"supplying fabrication & erection of new gates embeded ,hoisting arrangment ,hoisting bridge ,Approch ladder&civil work at BHARTPUR SINGHARA MAHUA In BAYA river under water drainge division Hajipur.",1775237.0,02/2021-22-GR-09/IMD/MUZAFFARPUR,2022-02-27,120,INR,,101,101,1556,1056,2,N,,7,25-02-2022,1775237.0
18783,"construction of p.c.c road & drain work at dhobi tola  ramdarbaar from house of rajeev kumar to pramod ram via house of yogendra ram in ward no-18, under nagar parishad khagaria for the year of 2021-22.","construction of p.c.c road & drain work at dhobi tola  ramdarbaar from house of rajeev kumar to pramod ram via house of yogendra ram in ward no-18, under nagar parishad khagaria for the year of 2021-22.",538.800.895.,"construction of p.c.c road & drain work at dhobi tola  ramdarbaar from house of rajeev kumar to pramod ram via house of yogendra ram in ward no-18, under nagar parishad khagaria for the year of 2021-22.",806364.0,NIT 10/2021-22 KHG G.No-21,2022-02-10,120,INR,,101,101,1557,895,1,N,,7,09-02-2022,806364.0
19409,CONSTRUCTION OF RCC  DRAIN & PCC ROAD FROM  IN BIR BASAWAN SINGH NAGAR AWASIYA COLONY MAIN ROAD PARYAG MILL TO SANTOSH JI KIRANA STORE TO SUDAMA APARTMENT TO M.S MEMORIAL SCHOOL  IN WARD NO-02,CONSTRUCTION OF RCC  DRAIN & PCC ROAD FROM  IN BIR BASAWAN SINGH NAGAR AWASIYA COLONY MAIN ROAD PARYAG MILL TO SANTOSH JI KIRANA STORE TO SUDAMA APARTMENT TO M.S MEMORIAL SCHOOL  IN WARD NO-02,538.1517.1546.,CONSTRUCTION OF RCC  DRAIN & PCC ROAD FROM  IN BIR BASAWAN SINGH NAGAR AWASIYA COLONY MAIN ROAD PARYAG MILL TO SANTOSH JI KIRANA STORE TO SUDAMA APARTMENT TO M.S MEMORIAL SCHOOL  IN WARD NO-02,22262640.0,NIT NO-04/E/PATLIPUTRA/2022,2022-02-24,180,INR,,101,101,1557,1546,2,N,,7,24-02-2022,22262640.0
19469,"FABRICATION , ERECTION AND INSTALLATION OF OPERATING PLATEFORM , TRACE RACK , SILT EJECTOR WELL GATE , ETC. OF MAIN WESTERN CANAL  AT R.D. 46.70 C/R AT SURAJPURA (NEPAL)","FABRICATION , ERECTION AND INSTALLATION OF OPERATING PLATEFORM , TRACE RACK , SILT EJECTOR WELL GATE , ETC. OF MAIN WESTERN CANAL  AT R.D. 46.70 C/R AT SURAJPURA (NEPAL)",538.731.1051.1056.,"FABRICATION , ERECTION AND INSTALLATION OF OPERATING PLATEFORM , TRACE RACK , SILT EJECTOR WELL GATE , ETC. OF MAIN WESTERN CANAL  AT R.D. 46.70 C/R AT SURAJPURA (NEPAL)",3920705.0,06E/2021-22-GR-01/IMD/VALMIKINAGAR,2022-02-26,120,INR,,101,101,1556,1056,2,N,,7,25-02-2022,3920705.0
19453,"SUPPLYING ,FABRICATION  AND ERECTION OF NEW GATES ,EMBEADED,HOISTING ARRANGEMENT,HOISTING BRIDGE ,PARAPET ,APPROCH LADDER  AND CIVIL WORK AT BAYA DIH IN BAYA RIVER LEFT EMBANKMENT AND  VISHUNPUR   IN BAYA RIVER RIGHT EMBANKMENT UNDER WATER DRAINGE DIVISION MUZAFFARPUR","SUPPLYING ,FABRICATION  AND ERECTION OF NEW GATES ,EMBEADED,HOISTING ARRANGEMENT,HOISTING BRIDGE ,PARAPET ,APPROCH LADDER  AND CIVIL WORK AT BAYA DIH IN BAYA RIVER LEFT EMBANKMENT AND  VISHUNPUR   IN BAYA RIVER RIGHT EMBANKMENT UNDER WATER DRAINGE DIVISION MUZAFFARPUR",538.731.1051.1056.,"SUPPLYING ,FABRICATION  AND ERECTION OF NEW GATES ,EMBEADED,HOISTING ARRANGEMENT,HOISTING BRIDGE ,PARAPET ,APPROCH LADDER  AND CIVIL WORK AT BAYA DIH IN BAYA RIVER LEFT EMBANKMENT AND  VISHUNPUR   IN BAYA RIVER RIGHT EMBANKMENT UNDER WATER DRAINGE DIVISION MUZAFFARPUR",2236702.0,02/2021-22-GR-14/IMD/MUZAFFARPUR,2022-02-27,120,INR,,101,101,1556,1056,2,N,,6,25-02-2022,2236702.0
19003,"EC Approved Sandghats of BHOJPUR (Cluster -07)
FATEHPUR SAND GHAT (Mineable Quantity - 7200000 CFT)","EC Approved Sandghats of BHOJPUR (Cluster -07)
FATEHPUR SAND GHAT (Mineable Quantity - 7200000 CFT)",538.2005.,"EC Approved Sandghats of BHOJPUR (Cluster -07)
FATEHPUR SAND GHAT (Mineable Quantity - 7200000 CFT)",30444661.0,BSMCL-09/2021-22/BHOJPUR/CLUSTER-07,2022-02-15,180,INR,,102,121,1559,2005,1,N,,4,14-02-2022,30444661.0
19593,Construction of rcc drain with cover in aman colony from house of munni khatoon jee to house of akbar bhai jee both side in ward no 23 under nagar parishad phulwari sharif,Construction of rcc drain with cover in aman colony from house of munni khatoon jee to house of akbar bhai jee both side in ward no 23 under nagar parishad phulwari sharif,538.800.823.,Construction of rcc drain with cover in aman colony from house of munni khatoon jee to house of akbar bhai jee both side in ward no 23 under nagar parishad phulwari sharif,1942254.0,NIT12/2021-22/GR-34,2022-02-28,180,INR,,101,101,1557,823,1,N,,7,28-02-2022,1942254.0
18838,"Construction of  P.C.C. Road and Drain from House of Sri Janardan Singh to the House of Mahendra Chaudhary in Noonfar Muhalla in Ward No.-41 under MMC, Muzaffarpur. GROUP-22","Construction of  P.C.C. Road and Drain from House of Sri Janardan Singh to the House of Mahendra Chaudhary in Noonfar Muhalla in Ward No.-41 under MMC, Muzaffarpur. GROUP-22",538.800.892.,"Construction of  P.C.C. Road and Drain from House of Sri Janardan Singh to the House of Mahendra Chaudhary in Noonfar Muhalla in Ward No.-41 under MMC, Muzaffarpur. GROUP-22",865329.0,NIT-15/MMC/MUZAFFARPUR/2021-22/GR-22,2022-02-10,180,INR,,101,101,1557,892,1,N,,7,10-02-2022,865329.0
18750,"Construction of  P.C.C. Road and Drain from House of Sujit Kumar to House of Binay Kumar Singh via House of Bhola Ojha, Mamta Kumari  in Laxmi Narayan Colony Gali No.-20 in Ward No.-48 under MMC, Muzaffarpur. GROUP-28","Construction of  P.C.C. Road and Drain from House of Sujit Kumar to House of Binay Kumar Singh via House of Bhola Ojha, Mamta Kumari  in Laxmi Narayan Colony Gali No.-20 in Ward No.-48 under MMC, Muzaffarpur. GROUP-28",538.800.892.,"Construction of  P.C.C. Road and Drain from House of Sujit Kumar to House of Binay Kumar Singh via House of Bhola Ojha, Mamta Kumari  in Laxmi Narayan Colony Gali No.-20 in Ward No.-48 under MMC, Muzaffarpur. GROUP-28",6822909.0,NIT-15/MMC/2021-22/MUZAFFARPUR/GR-28,2022-02-10,120,INR,,101,101,1557,892,2,N,,7,09-02-2022,6822909.0
18688,NIT 02/2021-22 Group 07,Renovation of Babhandiha  Ahar Pyne  Scheme Under M.I. Division Nalanda,538.1420.1422.1425.1435.,NIT 02/2021-22 Group 07,7792167.0,"02/2021-22 MID, Nalanda Group 07",2022-02-06,120,INR,,101,101,1557,1435,2,N,,7,06-02-2022,7792167.0
19200,Construction of Drain cum Solling and PCC road from house of Ajay Mishra to House of surendra jha in Ward no 03.(Detail as per NIT),Construction of Drain cum Solling and PCC road from house of Ajay Mishra to House of surendra jha in Ward no 03.(Detail as per NIT),538.800.825.,Construction of Drain cum Solling and PCC road from house of Ajay Mishra to House of surendra jha in Ward no 03.(Detail as per NIT),1753400.0,NP/SHC/NIT04/2021-22/Gr-03,2022-02-17,120,INR,,101,101,1557,825,1,N,,7,17-02-2022,1753400.0
19202,Construction of Drain cum Solling and PCC road in North of Sarwanarayan college road from house of Paswan Dealer house to????. Bablo yadav house in Ward 05.(Detail as per NIT),Construction of Drain cum Solling and PCC road in North of Sarwanarayan college road from house of Paswan Dealer house to????. Bablo yadav house in Ward 05.(Detail as per NIT),538.800.825.,Construction of Drain cum Solling and PCC road in North of Sarwanarayan college road from house of Paswan Dealer house to????. Bablo yadav house in Ward 05.(Detail as per NIT),1862600.0,NP/SHC/NIT04/2021-22/Gr-05,2022-02-17,120,INR,,101,101,1557,825,1,N,,7,17-02-2022,1862600.0
18965,"Construction of soil filling and brick soling in anita devi house from singh ji house, ranjan yadav house from mukesh bhagat house ewam rahul ji house from pawan ji house ewam braham sthan from shiv chandra poddar house ewam pran prakash fouji house from fouji ji house ewam binod das house from vasisth das house in ward no-38","Construction of soil filling and brick soling in anita devi house from singh ji house, ranjan yadav house from mukesh bhagat house ewam rahul ji house from pawan ji house ewam braham sthan from shiv chandra poddar house ewam pran prakash fouji house from fouji ji house ewam binod das house from vasisth das house in ward no-38",538.800.887.,"Construction of soil filling and brick soling in anita devi house from singh ji house, ranjan yadav house from mukesh bhagat house ewam rahul ji house from pawan ji house ewam braham sthan from shiv chandra poddar house ewam pran prakash fouji house from fouji ji house ewam binod das house from vasisth das house in ward no-38",848300.0,GR-04NIT-02/2021-22NNBEGUSARAI,2022-02-14,180,INR,,101,101,1557,887,1,N,,7,14-02-2022,848300.0
19450,"SUPPLYING ,FABRICATION  AND ERECTION OF NEW GATES ,EMBEADED,HOISTING ARRANGEMENT,HOISTING BRIDGE ,PARAPET ,APPROCH LADDER  AND CIVIL WORK AT   RAGHUNATH PUR -2  ( R/S ) IN BAYA RIVER LEFT EMBANKMENT AND PARHARIYA (R/S) BAYA RIVER RIGHT EMBANKMENT UNDER WATER DRAINGE DIVISION MUZAFFARPUR","SUPPLYING ,FABRICATION  AND ERECTION OF NEW GATES ,EMBEADED,HOISTING ARRANGEMENT,HOISTING BRIDGE ,PARAPET ,APPROCH LADDER  AND CIVIL WORK AT   RAGHUNATH PUR -2  ( R/S ) IN BAYA RIVER LEFT EMBANKMENT AND PARHARIYA (R/S) BAYA RIVER RIGHT EMBANKMENT UNDER WATER DRAINGE DIVISION MUZAFFARPUR",538.731.1051.1056.,"SUPPLYING ,FABRICATION  AND ERECTION OF NEW GATES ,EMBEADED,HOISTING ARRANGEMENT,HOISTING BRIDGE ,PARAPET ,APPROCH LADDER  AND CIVIL WORK AT   RAGHUNATH PUR -2  ( R/S ) IN BAYA RIVER LEFT EMBANKMENT AND PARHARIYA (R/S) BAYA RIVER RIGHT EMBANKMENT UNDER WATER DRAINGE DIVISION MUZAFFARPUR",1734804.0,02/2021-22-GR-12/IMD/MUZAFFARPUR,2022-02-27,120,INR,,101,101,1556,1056,2,N,,6,25-02-2022,1734804.0
19035,"EC Approved Sandghats of GAYA (Cluster- 37)
CHAPARDAH  SAND GHAT (Mineable Quantity -10150825 CFT)","EC Approved Sandghats of GAYA (Cluster- 37)
CHAPARDAH  SAND GHAT (Mineable Quantity -10150825 CFT)",538.2005.,"EC Approved Sandghats of GAYA (Cluster- 37)
CHAPARDAH  SAND GHAT (Mineable Quantity -10150825 CFT)",8564859.0,BSMCL-09/2021-22/Gaya/CLUSTER- 37,2022-02-15,180,INR,,102,121,1559,2005,1,N,,4,15-02-2022,8564859.0
18824,"Construction of  P.C.C. Road and R.C.C. Drain from Manoj Kumar Singh to Ram Uday Babu in Ward No.-12 under MMC, Muzaffarpur. GROUP-06","Construction of  P.C.C. Road and R.C.C. Drain from Manoj Kumar Singh to Ram Uday Babu in Ward No.-12 under MMC, Muzaffarpur. GROUP-06",538.800.892.,"Construction of  P.C.C. Road and R.C.C. Drain from Manoj Kumar Singh to Ram Uday Babu in Ward No.-12 under MMC, Muzaffarpur. GROUP-06",2034446.0,NIT-15/MMC/MUZAFFARPUR/2021-22/GR-06,2022-02-10,180,INR,,101,101,1557,892,1,N,,7,10-02-2022,2034446.0
19088,"Construction of  road cum drain from the house of Sokan hakur to the hosue of Subhash Thakur at ward No.-17, Under Nagar Parishad, Benipur.","Construction of  road cum drain from the house of Sokan hakur to the hosue of Subhash Thakur at ward No.-17, Under Nagar Parishad, Benipur.",538.800.890.,"Construction of  road cum drain from the house of Sokan hakur to the hosue of Subhash Thakur at ward No.-17, Under Nagar Parishad, Benipur.",1020200.0,BMC-NIT-02/2021-22/GR-30,2022-02-15,90,INR,,101,101,1557,890,1,N,,7,15-02-2022,1020200.0
19363,Construction of U/G drain & PCC Road in Kaddush Compund Pura in ward no. 40.,Construction of U/G drain & PCC Road in Kaddush Compund Pura in ward no. 40.,538.1517.1914.,Construction of U/G drain & PCC Road in Kaddush Compund Pura in ward no. 40.,648641.0,"03/E/Bankipur/2022, Group No. 03",2022-02-23,120,INR,,101,101,1557,1914,1,N,,4,23-02-2022,648641.0
18858,"Construction of  RCC Staging 4Mx3Mx8M High in  At Ward No:-15 bharhopur western part Nagar Panchayt Ekma Bazar, Saran Distt.","Construction of  RCC Staging 4Mx3Mx8M High in  At Ward No:-15 bharhopur western part Nagar Panchayt Ekma Bazar, Saran Distt.",538.800.1245.,"Construction of  RCC Staging 4Mx3Mx8M High in  At Ward No:-15 bharhopur western part Nagar Panchayt Ekma Bazar, Saran Distt.",633531.0,NIT-01/2021-22 GR-12,2022-02-10,120,INR,,101,101,1557,1245,1,N,,6,10-02-2022,633531.0
19238,Construction of Paver Block in ward no-10 from Tej Pratap House via Samudayak Bhawan to Jaylal Ray House,Construction of Paver Block in ward no-10 from Tej Pratap House via Samudayak Bhawan to Jaylal Ray House,538.800.857.,Construction of Paver Block in ward no-10 from Tej Pratap House via Samudayak Bhawan to Jaylal Ray House,729926.0,"PNP/NIT-03/2021-22,-GR07",2022-02-17,120,INR,,101,101,1557,857,1,N,,7,17-02-2022,729926.0
19222,"Cons. of P.C.C Road at Ward No.-03 Shastri Nagar Road to Manbodh Jha, Shastri Nagar Road to Prabhat Singh, Shastri Nagar Road via. Sajal Das, Anmol Singh, Pappu Jee to Sanjay Mishra, Virendra Roy to h/f Simakant Mishra for Year 2020-2021 Nagar Nigam Purnea.","Cons. of P.C.C Road at Ward No.-03 Shastri Nagar Road to Manbodh Jha, Shastri Nagar Road to Prabhat Singh, Shastri Nagar Road via. Sajal Das, Anmol Singh, Pappu Jee to Sanjay Mishra, Virendra Roy to h/f Simakant Mishra for Year 2020-2021 Nagar Nigam Purnea.",538.800.806.,"Cons. of P.C.C Road at Ward No.-03 Shastri Nagar Road to Manbodh Jha, Shastri Nagar Road to Prabhat Singh, Shastri Nagar Road via. Sajal Das, Anmol Singh, Pappu Jee to Sanjay Mishra, Virendra Roy to h/f Simakant Mishra for Year 2020-2021 Nagar Nigam Purnea.",4075997.0,RE-NIT-NNP-05/2021-22-GR01,2022-02-17,120,INR,,101,101,1557,806,1,N,,6,17-02-2022,4075997.0
18804,"construction of r.c.c cluvert work from om hospital to s.i kiran kumari via shobha sadan , uttasav place , d.a.v chowk rajendra nagar , under nagar parishad , Khagaria for the Year of 2021-22.","construction of r.c.c cluvert work from om hospital to s.i kiran kumari via shobha sadan , uttasav place , d.a.v chowk rajendra nagar , under nagar parishad , Khagaria for the Year of 2021-22.",538.800.895.,"construction of r.c.c cluvert work from om hospital to s.i kiran kumari via shobha sadan , uttasav place , d.a.v chowk rajendra nagar , under nagar parishad , Khagaria for the Year of 2021-22.",4194103.0,NIT 10/2021-22 KHG G.No-42,2022-02-10,120,INR,,101,101,1557,895,1,N,,7,10-02-2022,4194103.0
19086,"Construction of R.C.C.  drain from Lakshmanpur-Dharaura road to Mahadev Sthan Pokhar at Ward No.-16, Under Nagar Parishad, Benipur.","Construction of R.C.C.  drain from Lakshmanpur-Dharaura road to Mahadev Sthan Pokhar at Ward No.-16, Under Nagar Parishad, Benipur.",538.800.890.,"Construction of R.C.C.  drain from Lakshmanpur-Dharaura road to Mahadev Sthan Pokhar at Ward No.-16, Under Nagar Parishad, Benipur.",2985700.0,BMC-NIT-02/2021-22/GR-0028,2022-02-15,90,INR,,101,101,1557,890,1,N,,7,15-02-2022,2985700.0
18994,"Remaining work  of Stadium Laxmi Narayan Janta +2 high school, Khutauna in District- Madhubani for the year- 2021-22","Remaining work  of Stadium Laxmi Narayan Janta +2 high school, Khutauna in District- Madhubani for the year- 2021-22",538.1026.1096.1206.1209.,"Remaining work  of Stadium Laxmi Narayan Janta +2 high school, Khutauna in District- Madhubani for the year- 2021-22",2123445.0,NIT50/BCD/MADHUBANI/2021-22,2022-02-14,120,INR,,101,101,1557,1209,1,N,,7,14-02-2022,2123445.0
19094,"Construction of  P.C.C. Road with R.C.C. Drain from Brahmpura Chowk to Damodarpur Railway Line in Ward No.-06 under MMC, Muzaffarpur. GROUP-04","Construction of  P.C.C. Road with R.C.C. Drain from Brahmpura Chowk to Damodarpur Railway Line in Ward No.-06 under MMC, Muzaffarpur. GROUP-04",538.800.892.,"Construction of  P.C.C. Road with R.C.C. Drain from Brahmpura Chowk to Damodarpur Railway Line in Ward No.-06 under MMC, Muzaffarpur. GROUP-04",8846769.0,NIT-17/MMC/2021-22/MUZAFFARPUR/GR-04,2022-02-15,180,INR,,101,101,1557,892,2,N,,7,15-02-2022,8846769.0
