19288,Scheme for Sinking of 35 No. New India Mark II hand pumps in Habitations (SC) ID Under IMIS of Jal Shakti (Hand Pump with Platform and Drain) Under Special Central Assistance to Scheduled Caste Sub Paln (SCA to SCSP) for the Year 2021-22,Scheme for Sinking of 35 No. New India Mark II hand pumps in Habitations (SC) ID Under IMIS of Jal Shakti (Hand Pump with Platform and Drain) Under Special Central Assistance to Scheduled Caste Sub Paln (SCA to SCSP) for the Year 2021-22,538.790.1027.1028.1031.,Scheme for Sinking of 35 No. New India Mark II hand pumps in Habitations (SC) ID Under IMIS of Jal Shakti (Hand Pump with Platform and Drain) Under Special Central Assistance to Scheduled Caste Sub Paln (SCA to SCSP) for the Year 2021-22,2150610.0,NIT-03-PHED/BGS/2021-22(RE),2022-02-21,180,INR,,101,101,1554,1031,2,N,,7,21-02-2022,2150610.0
19203,Construction of Solling and PCC road from house of Tarini Yadav to ???... land of Ekkan yadav in Ward no 06.(Detail as per NIT),Construction of Solling and PCC road from house of Tarini Yadav to ???... land of Ekkan yadav in Ward no 06.(Detail as per NIT),538.800.825.,Construction of Solling and PCC road from house of Tarini Yadav to ???... land of Ekkan yadav in Ward no 06.(Detail as per NIT),1862100.0,NP/SHC/NIT04/2021-22/Gr-06,2022-02-17,120,INR,,101,101,1557,825,1,N,,7,17-02-2022,1862100.0
19362,Construction of PCC Work From Batraha Thakur Chowk to ............................Bhupan Das House Ward no- 24.(Detail as per NIT),Construction of PCC Work From Batraha Thakur Chowk to ............................Bhupan Das House Ward no- 24.(Detail as per NIT),538.800.825.,Construction of PCC Work From Batraha Thakur Chowk to ............................Bhupan Das House Ward no- 24.(Detail as per NIT),1690600.0,NP/SHC/NIT04/2021-22/Gr-40,2022-02-23,120,INR,,101,101,1557,825,1,N,,7,23-02-2022,1690600.0
18993,"Construction of R.C.C.  drain from Mohan Bahera Patartoli via the house of Kashi Mahapatra to the house of Nilambar Jha at Ward No.-02, Under Nagar Parishad, Benipur.","Construction of R.C.C.  drain from Mohan Bahera Patartoli via the house of Kashi Mahapatra to the house of Nilambar Jha at Ward No.-02, Under Nagar Parishad, Benipur.",538.800.890.,"Construction of R.C.C.  drain from Mohan Bahera Patartoli via the house of Kashi Mahapatra to the house of Nilambar Jha at Ward No.-02, Under Nagar Parishad, Benipur.",923000.0,BMC-NIT-02/2021-22/GR-0001,2022-02-15,90,INR,,101,101,1557,890,1,N,,7,14-02-2022,923000.0
19393,Construction of RCC Nala Work From Creative Mind School to Surendra Sah House & Musahari Tola to.......... Bajrangbali Sthan Via Asha Singh House Ward no- 27.(Detail as per NIT),Construction of RCC Nala Work From Creative Mind School to Surendra Sah House & Musahari Tola to.......... Bajrangbali Sthan Via Asha Singh House Ward no- 27.(Detail as per NIT),538.800.825.,Construction of RCC Nala Work From Creative Mind School to Surendra Sah House & Musahari Tola to.......... Bajrangbali Sthan Via Asha Singh House Ward no- 27.(Detail as per NIT),2198100.0,NP/SHC/NIT04/2021-22/Gr-43,2022-02-24,120,INR,,101,101,1557,825,1,N,,7,24-02-2022,2198100.0
19424,Construction of U/G drain and PCC Road from Sabjibagh Machua Gali in ward no. 40.,Construction of U/G drain and PCC Road from Sabjibagh Machua Gali in ward no. 40.,538.1517.1914.,Construction of U/G drain and PCC Road from Sabjibagh Machua Gali in ward no. 40.,562356.0,"03/E/Bankipur/2022, Group No. 17",2022-02-24,120,INR,,101,101,1557,1914,1,N,,4,24-02-2022,562356.0
19100,"Construction of RCC drain from the house of Jay paswan to the Teen Kon Dhar  at ward No.-21, Under Nagar Parishad, Benipur.","Construction of RCC drain from the house of Jay paswan to the Teen Kon Dhar  at ward No.-21, Under Nagar Parishad, Benipur.",538.800.890.,"Construction of RCC drain from the house of Jay paswan to the Teen Kon Dhar  at ward No.-21, Under Nagar Parishad, Benipur.",591600.0,BMC-NIT-02/2021-22/GR-39,2022-02-15,90,INR,,101,101,1557,890,1,N,,7,15-02-2022,591600.0
18639,ANTI EROSION WORK IN RIGHT EMBANKMENT OF ZERAINE RIVER NEAR TRIKONA KHANDHA (Agenda No. 182/16/2022) (GROUP-01),ANTI EROSION WORK IN RIGHT EMBANKMENT OF ZERAINE RIVER NEAR TRIKONA KHANDHA (Agenda No. 182/16/2022) (GROUP-01),538.731.1092.1117.,ANTI EROSION WORK IN RIGHT EMBANKMENT OF ZERAINE RIVER NEAR TRIKONA KHANDHA (Agenda No. 182/16/2022) (GROUP-01),9708635.0,08/2021-22/FCDD-BIHARSHARIF/WRD/01,2022-02-02,120,INR,,101,101,1557,1117,2,N,,7,02-02-2022,9708635.0
18991,"EC Approved Sand Ghat of KISHANGANJ (Cluster- 17) 
CHENGA GHAT & THAKURGANJ SAND GHAT ( MINEABLE QUANTITY-4124742.5 CFT)","EC Approved Sand Ghat of KISHANGANJ (Cluster- 17) 
CHENGA GHAT & THAKURGANJ SAND GHAT ( MINEABLE QUANTITY-4124742.5 CFT)",538.2005.,"EC Approved Sand Ghat of KISHANGANJ (Cluster- 17) 
CHENGA GHAT & THAKURGANJ SAND GHAT ( MINEABLE QUANTITY-4124742.5 CFT)",1220844.15,BSMCL-09/2021-22/KISHANGANJ/CLUSTER-17,2022-02-14,180,INR,,102,121,1559,2005,1,N,,7,14-02-2022,1220844.15
19359,Construction of PCC Work From Ram Chandra Ram House to .......Kamlesh Verma House in   Ward no- 23.(Detail as per NIT),Construction of PCC Work From Ram Chandra Ram House to .......Kamlesh Verma House in   Ward no- 23.(Detail as per NIT),538.800.825.,Construction of PCC Work From Ram Chandra Ram House to .......Kamlesh Verma House in   Ward no- 23.(Detail as per NIT),937233.0,NP/SHC/NIT04/2021-22/Gr-38,2022-02-23,120,INR,,101,101,1557,825,1,N,,7,23-02-2022,937233.0
19597,Construction of pcc road & drain in fedral colony isopur from house of late Dr samer saheb to house of pappu ji to house of G M Acadmy to aftab manzil to house of rashid bhai to house of marrage holl in ward no 26 under nagar parishad phulwari sharif,Construction of pcc road & drain in fedral colony isopur from house of late Dr samer saheb to house of pappu ji to house of G M Acadmy to aftab manzil to house of rashid bhai to house of marrage holl in ward no 26 under nagar parishad phulwari sharif,538.800.823.,Construction of pcc road & drain in fedral colony isopur from house of late Dr samer saheb to house of pappu ji to house of G M Acadmy to aftab manzil to house of rashid bhai to house of marrage holl in ward no 26 under nagar parishad phulwari sharif,2486551.0,NIT12/2021-22/GR-38,2022-02-28,180,INR,,101,101,1557,823,1,N,,7,28-02-2022,2486551.0
18774,"construction of p.c.c road & drain work from house of Rajkumar poddar to barkat miya via house of manoj pandit,md.amir , dinesh mahto , jawahar miya  in ward no-12, under nagar parishad khagaria for the year of 2021-22.","construction of p.c.c road & drain work from house of Rajkumar poddar to barkat miya via house of manoj pandit,md.amir , dinesh mahto , jawahar miya  in ward no-12, under nagar parishad khagaria for the year of 2021-22.",538.800.895.,"construction of p.c.c road & drain work from house of Rajkumar poddar to barkat miya via house of manoj pandit,md.amir , dinesh mahto , jawahar miya  in ward no-12, under nagar parishad khagaria for the year of 2021-22.",1271998.0,NIT 10/2021-22 KHG G.No-12,2022-02-10,120,INR,,101,101,1557,895,1,N,,6,09-02-2022,1271998.0
19387,Construction of Nala & Paver Block Work From Masraf Chowk to Urdu Middle School in Ward no- 38.(Detail as per NIT),Construction of Nala & Paver Block Work From Masraf Chowk to Urdu Middle School in Ward no- 38.(Detail as per NIT),538.800.825.,Construction of Nala & Paver Block Work From Masraf Chowk to Urdu Middle School in Ward no- 38.(Detail as per NIT),1090977.0,NP/SHC/NIT04/2021-22/Gr-60,2022-02-24,120,INR,,101,101,1557,825,1,N,,7,24-02-2022,1090977.0
19572,"Construction of Prakhand cum Circle office cum residential bldg, Inspection room and Campus Development of Sadar Prakhand, Begusarai. (2021-22)","Construction of Prakhand cum Circle office cum residential bldg, Inspection room and Campus Development of Sadar Prakhand, Begusarai. (2021-22)",538.1026.1096.1206.1208.,"Construction of Prakhand cum Circle office cum residential bldg, Inspection room and Campus Development of Sadar Prakhand, Begusarai. (2021-22)",183652904.0,RE E-TENDER-16/EEBDBGS/2021-2022,2022-02-27,120,INR,,101,101,1557,1208,2,N,,7,27-02-2022,183652904.0
19556,Construction of RCC Drain with paver block from house of dilip mathur to house of rambhaju mathuri in ward no 09 pf nagar panchayat jhajha for financial year 2019-20,Construction of RCC Drain with paver block from house of dilip mathur to house of rambhaju mathuri in ward no 09 pf nagar panchayat jhajha for financial year 2019-20,538.800.2047.,Construction of RCC Drain with paver block from house of dilip mathur to house of rambhaju mathuri in ward no 09 pf nagar panchayat jhajha for financial year 2019-20,294800.0,07/2021-22/GR01/NPJHAJA,2022-02-27,180,INR,,101,101,1557,2047,1,N,,6,26-02-2022,294800.0
18898,"EC Approved Sand Ghat of Aurangabad (Cluster-3) 
TETARIYA:( MINEABLE QUANTITY-6675480 CFT)","EC Approved Sand Ghat of Aurangabad (Cluster-3) 
TETARIYA:( MINEABLE QUANTITY-6675480 CFT)",538.2005.,"EC Approved Sand Ghat of Aurangabad (Cluster-3) 
TETARIYA:( MINEABLE QUANTITY-6675480 CFT)",39289578.0,BSMCL-09/2021-22/AURANGABAD/CLUSTER-3,2022-02-14,180,INR,,102,121,1559,2005,1,N,,4,13-02-2022,39289578.0
19395,Construction of PCC Road Work from By Pass Road to.................BUDCO Main Nala  .(Detail as per NIT),Construction of PCC Road Work from By Pass Road to.................BUDCO Main Nala  .(Detail as per NIT),538.800.825.,Construction of PCC Road Work from By Pass Road to.................BUDCO Main Nala  .(Detail as per NIT),3897200.0,NP/SHC/NIT04/2021-22/Gr-66,2022-02-24,120,INR,,101,101,1557,825,1,N,,7,24-02-2022,3897200.0
19420,Construction of U/G dain and PCC Road from house of Mojphar to Dariyapur Gaya Bekari in ward no. 40.,Construction of U/G dain and PCC Road from house of Mojphar to Dariyapur Gaya Bekari in ward no. 40.,538.1517.1914.,Construction of U/G dain and PCC Road from house of Mojphar to Dariyapur Gaya Bekari in ward no. 40.,156169.0,"03/E/Bankipur/2022, Group No. 15",2022-02-24,120,INR,,101,101,1557,1914,1,N,,4,24-02-2022,156169.0
19085,"Construction of RCC drain from main road to the house of Bhagwan Thakur via the house of Dinesh Thakur  at ward No.-15, Under Nagar Parishad, Benipur.","Construction of RCC drain from main road to the house of Bhagwan Thakur via the house of Dinesh Thakur  at ward No.-15, Under Nagar Parishad, Benipur.",538.800.890.,"Construction of RCC drain from main road to the house of Bhagwan Thakur via the house of Dinesh Thakur  at ward No.-15, Under Nagar Parishad, Benipur.",890900.0,BMC-NIT-02/2021-22/GR-0027,2022-02-15,90,INR,,101,101,1557,890,1,N,,7,15-02-2022,890900.0
19010,"EC Approved Sandghats of BHOJPUR (Cluster- 48)
MANACHAK SAND GHAT (Mineable Quantity -6544337.50 CFT)","EC Approved Sandghats of BHOJPUR (Cluster- 48)
MANACHAK SAND GHAT (Mineable Quantity -6544337.50 CFT)",538.2005.,"EC Approved Sandghats of BHOJPUR (Cluster- 48)
MANACHAK SAND GHAT (Mineable Quantity -6544337.50 CFT)",32619279.75,BSMCL-09/2021-22/BHOJPUR/CLUSTER-48,2022-02-15,180,INR,,102,121,1559,2005,1,N,,7,14-02-2022,32619279.75
19316,NIT-06/2021-22,Renovation of Murdary Ahar,538.1420.1424.1431.1462.,NIT-06/2021-22,4822927.0,NIT-6/2021-22/GR-15,2022-02-22,180,INR,,101,101,1554,1462,2,N,,7,22-02-2022,4822927.0
19021,"EC Approved Sand Ghat of ROHTAS  (Cluster-07) 
DARIHAT 1, DARIHAT 2 & DARIHAT 3 SAND GHAT  ( MINEABLE QUANTITY- 13307481 CFT)","EC Approved Sand Ghat of ROHTAS  (Cluster-07) 
DARIHAT 1, DARIHAT 2 & DARIHAT 3 SAND GHAT  ( MINEABLE QUANTITY- 13307481 CFT)",538.2005.,"EC Approved Sand Ghat of ROHTAS  (Cluster-07) 
DARIHAT 1, DARIHAT 2 & DARIHAT 3 SAND GHAT  ( MINEABLE QUANTITY- 13307481 CFT)",95906205.0,BSMCL-09/2021-22/ROHTAS/CLUSTER-07,2022-02-15,180,INR,,102,121,1559,2005,1,N,,4,14-02-2022,95906205.0
19109,"Construction of  road cross drain from the house of Raja Yadav to the road near middle School at ward No.-25, Under Nagar Parishad, Benipur.","Construction of  road cross drain from the house of Raja Yadav to the road near middle School at ward No.-25, Under Nagar Parishad, Benipur.",538.800.890.,"Construction of  road cross drain from the house of Raja Yadav to the road near middle School at ward No.-25, Under Nagar Parishad, Benipur.",1832900.0,BMC-NIT-02/2021-22/GR-44,2022-02-15,90,INR,,101,101,1557,890,1,N,,7,15-02-2022,1832900.0
18919,"EC Approved Sand Ghat of Aurangabad (Cluster-40) 
HAMID NAGAR GHAT & BAIJALPUR GHAT  :( MINEABLE QUANTITY- 2711728.5 CFT)","EC Approved Sand Ghat of Aurangabad (Cluster-40) 
HAMID NAGAR GHAT & BAIJALPUR GHAT  :( MINEABLE QUANTITY- 2711728.5 CFT)",538.2005.,"EC Approved Sand Ghat of Aurangabad (Cluster-40) 
HAMID NAGAR GHAT & BAIJALPUR GHAT  :( MINEABLE QUANTITY- 2711728.5 CFT)",15960300.0,BSMCL-09/2021-22/AURANGABAD/CLUSTER-40,2022-02-14,180,INR,,102,121,1559,2005,1,N,,4,13-02-2022,15960300.0
18957,"Construction of soil filling, brick soling and pcc work in pipra main road from pramod singh house and manoj kumar house from umesh kumar land in ward no-15.","Construction of soil filling, brick soling and pcc work in pipra main road from pramod singh house and manoj kumar house from umesh kumar land in ward no-15.",538.800.887.,"Construction of soil filling, brick soling and pcc work in pipra main road from pramod singh house and manoj kumar house from umesh kumar land in ward no-15.",854383.0,GR-01NIT-02/2021-22NNBEGUSARAI,2022-02-14,180,INR,,101,101,1557,887,1,N,,7,14-02-2022,854383.0
19245,Construction of Paver Block in ward no-16 from Main Raod to Virendra Ray house,Construction of Paver Block in ward no-16 from Main Raod to Virendra Ray house,538.800.857.,Construction of Paver Block in ward no-16 from Main Raod to Virendra Ray house,121877.0,"PNP/NIT-03/2021-22,-GR13",2022-02-17,120,INR,,101,101,1557,857,1,N,,6,17-02-2022,121877.0
19044,"EC Approved Sandghats of LAKHISARAI(CLUSTER- 01)
KISHANPUR (Mineable Quantity -9644125 CFT)","EC Approved Sandghats of LAKHISARAI(CLUSTER- 01)
KISHANPUR (Mineable Quantity -9644125 CFT)",538.2005.,"EC Approved Sandghats of LAKHISARAI(CLUSTER- 01)
KISHANPUR (Mineable Quantity -9644125 CFT)",49756614.0,BSMCL-09/2021-22/LAKHISARAI/CLUSTER- 01,2022-02-15,180,INR,,102,121,1559,2005,1,N,,4,15-02-2022,49756614.0
19210,Construction of Paver block road from Deepak Yadav house to Bengali lala ji house  via ??? in Ward no 09.(Detail as per NIT),Construction of Paver block road from Deepak Yadav house to Bengali lala ji house  via ??? in Ward no 09.(Detail as per NIT),538.800.825.,Construction of Paver block road from Deepak Yadav house to Bengali lala ji house  via ??? in Ward no 09.(Detail as per NIT),164000.0,NP/SHC/NIT04/2021-22/Gr-13,2022-02-17,120,INR,,101,101,1557,825,1,N,,7,17-02-2022,164000.0
18803,"construction of Brick Edge soling road work from NH-31 (baleshwar sah ) to Lalan malik in ward no-26, under nagar parishad khagaria for the year of 2021-22.","construction of Brick Edge soling road work from NH-31 (baleshwar sah ) to Lalan malik in ward no-26, under nagar parishad khagaria for the year of 2021-22.",538.800.895.,"construction of Brick Edge soling road work from NH-31 (baleshwar sah ) to Lalan malik in ward no-26, under nagar parishad khagaria for the year of 2021-22.",1607536.0,NIT 10/2021-22 KHG G.No-41,2022-02-10,120,INR,,101,101,1557,895,1,N,,4,10-02-2022,1607536.0
19188,"Ward no.-33,34,35,37,38,39,41,42,43,44,45, avam 46 tak kul 20 sokhta ka nirman.","Ward no.-33,34,35,37,38,39,41,42,43,44,45, avam 46 tak kul 20 sokhta ka nirman.",538.800.1406.,"Ward no.-33,34,35,37,38,39,41,42,43,44,45, avam 46 tak kul 20 sokhta ka nirman.",222100.0,Re Tender NIT NO.- 10/2021 GR-09,2022-02-16,120,INR,,101,101,1557,1406,1,N,,4,16-02-2022,222100.0
19289,NIT No.-06/2021-22/MWRD BHAGALPUR/Gr-16,RENOVATION WORK OF SASBAHNA AHAR,538.1420.1424.1431.1460.,NIT No.-06/2021-22/MWRD BHAGALPUR/Gr-16,6264006.94,NIT No.-06/2021-22/MWRD BHAGALPUR/Gr-16,2022-02-22,120,INR,,101,101,1557,1460,2,N,,7,21-02-2022,6264006.94
19023,"EC Approved Sand Ghat of ROHTAS  (Cluster-10) 
PARUAHARA SAND GHAT 2  ( MINEABLE QUANTITY- 8135424 CFT)","EC Approved Sand Ghat of ROHTAS  (Cluster-10) 
PARUAHARA SAND GHAT 2  ( MINEABLE QUANTITY- 8135424 CFT)",538.2005.,"EC Approved Sand Ghat of ROHTAS  (Cluster-10) 
PARUAHARA SAND GHAT 2  ( MINEABLE QUANTITY- 8135424 CFT)",70389875.0,BSMCL-09/2021-22/ROHTAS/CLUSTER-10,2022-02-15,180,INR,,102,121,1559,2005,1,N,,4,14-02-2022,70389875.0
19536,Construction of rcc drain from house of mazhar bhai to house of pankaj gupta and house of ashvani singh to house of dinu miya in ward no 19 under nagar parishad phulwari sharif,Construction of rcc drain from house of mazhar bhai to house of pankaj gupta and house of ashvani singh to house of dinu miya in ward no 19 under nagar parishad phulwari sharif,538.800.823.,Construction of rcc drain from house of mazhar bhai to house of pankaj gupta and house of ashvani singh to house of dinu miya in ward no 19 under nagar parishad phulwari sharif,666665.0,NIT12/2021-22/GR-17,2022-02-26,180,INR,,101,101,1557,823,1,N,,7,26-02-2022,666665.0
19005,"EC Approved Sandghats of BHOJPUR (Cluster- 12)
ABGILA SAND GHAT (Mineable Quantity - 7457472 CFT)","EC Approved Sandghats of BHOJPUR (Cluster- 12)
ABGILA SAND GHAT (Mineable Quantity - 7457472 CFT)",538.2005.,"EC Approved Sandghats of BHOJPUR (Cluster- 12)
ABGILA SAND GHAT (Mineable Quantity - 7457472 CFT)",47841610.3,BSMCL-09/2021-22/BHOJPUR/CLUSTER-12,2022-02-15,180,INR,,102,121,1559,2005,1,N,,4,14-02-2022,47841610.3
18943,"PROVISION OF 1.5 TR. 5 STAR INVERTER SPLIT AIR CONDITIONING MACHINE COMPLETE SET etc. TO E.I IN THE DOCTOR'S HOSTEL AT ESIC MEDICAL COLLEGE & HOSPITAL AT BIHTA, DIST. PATNA, BIHAR.","PROVISION OF 1.5 TR. 5 STAR INVERTER SPLIT AIR CONDITIONING MACHINE COMPLETE SET etc. TO E.I IN THE DOCTOR'S HOSTEL AT ESIC MEDICAL COLLEGE & HOSPITAL AT BIHTA, DIST. PATNA, BIHAR.",538.1026.1097.1200.1229.,"PROVISION OF 1.5 TR. 5 STAR INVERTER SPLIT AIR CONDITIONING MACHINE COMPLETE SET etc. TO E.I IN THE DOCTOR'S HOSTEL AT ESIC MEDICAL COLLEGE & HOSPITAL AT BIHTA, DIST. PATNA, BIHAR.",2669044.0,18/BCD/EWD2/2021-22,2022-02-14,120,INR,,101,101,1522,1229,1,N,,6,14-02-2022,2669044.0
18694,NIT 02/2021-22 Group 01,Renovation of Perhuka Pyne  Scheme Under M.I. Division Nalanda,538.1420.1422.1425.1435.,NIT 02/2021-22 Group 01,6823600.0,"02/2021-22 MID, Nalanda Group-01",2022-02-06,120,INR,,101,101,1557,1435,2,N,,7,06-02-2022,6823600.0
18730,Construction of 06 Seated Community Toilet & 02 nos Bathroom near Surya Mandir Slum Area in Digha in ward no-01,Construction of 06 Seated Community Toilet & 02 nos Bathroom near Surya Mandir Slum Area in Digha in ward no-01,538.1517.1546.,Construction of 06 Seated Community Toilet & 02 nos Bathroom near Surya Mandir Slum Area in Digha in ward no-01,739737.0,NIT-01/E/PATLIPUTRA/2022 Gr-01,2022-02-09,180,INR,,101,101,1557,1546,1,N,,6,09-02-2022,739737.0
19608,Construction of pcc road & under ground drain in new sabajpura from house of surendra sharma to house of awdhesh sharma in ward no 01 under nagar parishad phulwari sharif,Construction of pcc road & under ground drain in new sabajpura from house of surendra sharma to house of awdhesh sharma in ward no 01 under nagar parishad phulwari sharif,538.800.823.,Construction of pcc road & under ground drain in new sabajpura from house of surendra sharma to house of awdhesh sharma in ward no 01 under nagar parishad phulwari sharif,827927.0,NIT12/2021-22/GR-49,2022-02-28,180,INR,,101,101,1557,823,1,N,,7,28-02-2022,827927.0
19583,Construction of rcc drain & pcc road in purnendu nagar from  house of ashok kumar singh to house of randhir kumar sinha in ward no 10 unedr nagar parishad phulwari sharif,Construction of rcc drain & pcc road in purnendu nagar from  house of ashok kumar singh to house of randhir kumar sinha in ward no 10 unedr nagar parishad phulwari sharif,538.800.823.,Construction of rcc drain & pcc road in purnendu nagar from  house of ashok kumar singh to house of randhir kumar sinha in ward no 10 unedr nagar parishad phulwari sharif,1819377.0,NIT12/2021-22/GR-28,2022-02-28,180,INR,,101,101,1557,823,1,N,,7,28-02-2022,1819377.0
18704,"Supply of Furniture and other items for Govt. Engineering College, ARWAL.","Supply of Furniture and other items for Govt. Engineering College, ARWAL.",538.1026.1095.1185.1187.,"Supply of Furniture and other items for Govt. Engineering College, ARWAL.",51024760.0,05/BCD/ARWAL/2021-22,2022-02-07,120,INR,,101,101,1554,1187,2,N,,7,07-02-2022,51024760.0
18757,NAGAR PANCHAYAT KOILWAR KE WARD 02 ME MIRJA DEVI KE GHAR SE GOPAL RAM KE GHAR HOTE HUE PRATHAMIK VIDHYALAY AVM MUKHYA SADAK TAK PCC NALI SOAKPIT NIRMAN KARYA,NAGAR PANCHAYAT KOILWAR KE WARD 02 ME MIRJA DEVI KE GHAR SE GOPAL RAM KE GHAR HOTE HUE PRATHAMIK VIDHYALAY AVM MUKHYA SADAK TAK PCC NALI SOAKPIT NIRMAN KARYA,538.800.969.,NAGAR PANCHAYAT KOILWAR KE WARD 02 ME MIRJA DEVI KE GHAR SE GOPAL RAM KE GHAR HOTE HUE PRATHAMIK VIDHYALAY AVM MUKHYA SADAK TAK PCC NALI SOAKPIT NIRMAN KARYA,741275.0,03/2021-22/Koil G.No-01,2022-02-10,120,INR,,101,101,1557,969,1,N,,7,09-02-2022,741275.0
19448,"FABRICATION, ERECTION AND RENOVATION OF A.F.S GATE ,EMBEDED, HOISTING PLATFORM, APPROACH LADDER WITH REQUIRED REPAIRE IN CIVIL STRUCTURE AT  BAHADURPUR KOTHIYA C/S 15.60 K.M AND PAHARCHAK I R/S 46.20 K.M  IN R/E U/S  OF B.G.R","FABRICATION, ERECTION AND RENOVATION OF A.F.S GATE ,EMBEDED, HOISTING PLATFORM, APPROACH LADDER WITH REQUIRED REPAIRE IN CIVIL STRUCTURE AT  BAHADURPUR KOTHIYA C/S 15.60 K.M AND PAHARCHAK I R/S 46.20 K.M  IN R/E U/S  OF B.G.R",538.731.1051.1056.,"FABRICATION, ERECTION AND RENOVATION OF A.F.S GATE ,EMBEDED, HOISTING PLATFORM, APPROACH LADDER WITH REQUIRED REPAIRE IN CIVIL STRUCTURE AT  BAHADURPUR KOTHIYA C/S 15.60 K.M AND PAHARCHAK I R/S 46.20 K.M  IN R/E U/S  OF B.G.R",1585807.0,02/2021-22-GR-11/IMD/MUZAFFARPUR,2022-02-27,120,INR,,101,101,1556,1056,2,N,,6,25-02-2022,1585807.0
19215,Construction of Solling and PCC road from Main Road to Chandan Ria house via ?????..in Ward no-01.(Detail as per NIT),Construction of Solling and PCC road from Main Road to Chandan Ria house via ?????..in Ward no-01.(Detail as per NIT),538.800.825.,Construction of Solling and PCC road from Main Road to Chandan Ria house via ?????..in Ward no-01.(Detail as per NIT),1535500.0,NP/SHC/NIT04/2021-22/Gr-18,2022-02-17,120,INR,,101,101,1557,825,1,N,,7,17-02-2022,1535500.0
19427,Construction of U/G drain and PCC Road from Mallik Gali to Chambal Ghati in ward no. 40.,Construction of U/G drain and PCC Road from Mallik Gali to Chambal Ghati in ward no. 40.,538.1517.1914.,Construction of U/G drain and PCC Road from Mallik Gali to Chambal Ghati in ward no. 40.,1025275.0,"03/E/Bankipur/2022, Group No. 19",2022-02-24,120,INR,,101,101,1557,1914,1,N,,4,24-02-2022,1025275.0
19548,Construction of RCC Drain and PCC Road Work from H/O Mirtunjay Kumar to Boundary of Munna Singh in Ward no.-17 Under Nagar Parishad Fatuha. (Re Tender),Construction of RCC Drain and PCC Road Work from H/O Mirtunjay Kumar to Boundary of Munna Singh in Ward no.-17 Under Nagar Parishad Fatuha. (Re Tender),538.800.1959.1960.1961.,Construction of RCC Drain and PCC Road Work from H/O Mirtunjay Kumar to Boundary of Munna Singh in Ward no.-17 Under Nagar Parishad Fatuha. (Re Tender),3695486.0,NIT 10/2021-22/NVPPE Gr.-03 (Re Tender),2022-02-26,120,INR,,101,101,1557,1961,1,N,,7,26-02-2022,3695486.0
19074,"Construction of R.C.C.  drain from the house of Kari Jha to the Devi Day Sthan Bahera-Baheri road at Ward No.-09, Under Nagar Parishad, Benipur.","Construction of R.C.C.  drain from the house of Kari Jha to the Devi Day Sthan Bahera-Baheri road at Ward No.-09, Under Nagar Parishad, Benipur.",538.800.890.,"Construction of R.C.C.  drain from the house of Kari Jha to the Devi Day Sthan Bahera-Baheri road at Ward No.-09, Under Nagar Parishad, Benipur.",1463500.0,BMC-NIT-02/2021-22/GR-0016,2022-02-15,90,INR,,101,101,1557,890,1,N,,7,15-02-2022,1463500.0
19347,Construction of PCC road from Sushil Yadav House to Yazuveer Yadav Fouzi House in Ward no- 16.(Detail as per NIT),Construction of PCC road from Sushil Yadav House to Yazuveer Yadav Fouzi House in Ward no- 16.(Detail as per NIT),538.800.825.,Construction of PCC road from Sushil Yadav House to Yazuveer Yadav Fouzi House in Ward no- 16.(Detail as per NIT),271600.0,NP/SHC/NIT04/2021-22/Gr-27,2022-02-23,120,INR,,101,101,1557,825,1,N,,7,23-02-2022,271600.0
19603,Construction of rcc drain with cover in gwal toli isopur from house of raju rai to devi asthan  nala in ward no 24 under nagar parishad phulwari sharif,Construction of rcc drain with cover in gwal toli isopur from house of raju rai to devi asthan  nala in ward no 24 under nagar parishad phulwari sharif,538.800.823.,Construction of rcc drain with cover in gwal toli isopur from house of raju rai to devi asthan  nala in ward no 24 under nagar parishad phulwari sharif,620068.0,NIT12/2021-22/GR-44,2022-02-28,180,INR,,101,101,1557,823,1,N,,7,28-02-2022,620068.0
18648,"Renovation/Modernisation of COE (Centre of Excellence) area in the campus of New Government Polytechnic, Patna - 13  for the year  2021-22","Renovation/Modernisation of COE (Centre of Excellence) area in the campus of New Government Polytechnic, Patna - 13  for the year  2021-22",538.1026.1093.1100.1177.,"Renovation/Modernisation of COE (Centre of Excellence) area in the campus of New Government Polytechnic, Patna - 13  for the year  2021-22",5004068.0,05/BCD/DANAPUR/2021-22,2022-02-02,120,INR,,101,101,1557,1177,2,N,,7,02-02-2022,5004068.0
19376,Construction of U/G drain & PCC Road from Golden Agarwati to Phakribara Mandir in wsard no. 40,Construction of U/G drain & PCC Road from Golden Agarwati to Phakribara Mandir in wsard no. 40,538.1517.1914.,Construction of U/G drain & PCC Road from Golden Agarwati to Phakribara Mandir in wsard no. 40,1578708.0,"03/E/Bankipur/2022, Group No. 07",2022-02-23,120,INR,,101,101,1557,1914,1,N,,4,23-02-2022,1578708.0
