19390,Construction of PCC Work From Md Sajjad House to Upendra Sada House ...........................to Md Usmaan House in Ward no- 40.(Detail as per NIT),Construction of PCC Work From Md Sajjad House to Upendra Sada House ...........................to Md Usmaan House in Ward no- 40.(Detail as per NIT),538.800.825.,Construction of PCC Work From Md Sajjad House to Upendra Sada House ...........................to Md Usmaan House in Ward no- 40.(Detail as per NIT),1116000.0,NP/SHC/NIT04/2021-22/Gr-63,2022-02-24,120,INR,,101,101,1557,825,1,N,,7,24-02-2022,1116000.0
18910,"EC Approved Sand Ghat of Aurangabad (Cluster-30) 
DUMUHAN GHAT & RAIPURA GHAT    :( MINEABLE QUANTITY- 2153123.66 CFT)","EC Approved Sand Ghat of Aurangabad (Cluster-30) 
DUMUHAN GHAT & RAIPURA GHAT    :( MINEABLE QUANTITY- 2153123.66 CFT)",538.2005.,"EC Approved Sand Ghat of Aurangabad (Cluster-30) 
DUMUHAN GHAT & RAIPURA GHAT    :( MINEABLE QUANTITY- 2153123.66 CFT)",12625051.0,BSMCL-09/2021-22/AURANGABAD/CLUSTER-30,2022-02-14,180,INR,,102,121,1559,2005,1,N,,4,13-02-2022,12625051.0
19046,"EC Approved Sand Ghat ofJAMUI  (Cluster-03) 
CHARDHARA & AMBASAND GHAT ( MINEABLE QUANTITY- 9747850 CFT)","EC Approved Sand Ghat ofJAMUI  (Cluster-03) 
CHARDHARA & AMBASAND GHAT ( MINEABLE QUANTITY- 9747850 CFT)",538.2005.,"EC Approved Sand Ghat ofJAMUI  (Cluster-03) 
CHARDHARA & AMBASAND GHAT ( MINEABLE QUANTITY- 9747850 CFT)",13868515.0,BSMCL-09/2021-22/JAMUI/CLUSTER-03,2022-02-15,180,INR,,102,121,1559,2005,1,N,,4,15-02-2022,13868515.0
19386,Construction of PCC Work From Kailash Sharma House to .................Bhairdhari Chowk   in Ward no- 37.(Detail as per NIT),Construction of PCC Work From Kailash Sharma House to .................Bhairdhari Chowk   in Ward no- 37.(Detail as per NIT),538.800.825.,Construction of PCC Work From Kailash Sharma House to .................Bhairdhari Chowk   in Ward no- 37.(Detail as per NIT),1586000.0,NP/SHC/NIT04/2021-22/Gr-59,2022-02-24,120,INR,,101,101,1557,825,1,N,,7,24-02-2022,1586000.0
19216,Construction of  PCC Road from Main Road 107 to Dream night hotel   ??? in Ward no 06.(Detail as per NIT),Construction of  PCC Road from Main Road 107 to Dream night hotel   ??? in Ward no 06.(Detail as per NIT),538.800.825.,Construction of  PCC Road from Main Road 107 to Dream night hotel   ??? in Ward no 06.(Detail as per NIT),1246200.0,NP/SHC/NIT04/2021-22/Gr-19,2022-02-17,120,INR,,101,101,1557,825,1,N,,7,17-02-2022,1246200.0
19018,"EC Approved Sandghats of GAYA (Cluster- 27)
BELBAR SAND GHAT (Mineable Quantity -8727475 CFT)","EC Approved Sandghats of GAYA (Cluster- 27)
BELBAR SAND GHAT (Mineable Quantity -8727475 CFT)",538.2005.,"EC Approved Sandghats of GAYA (Cluster- 27)
BELBAR SAND GHAT (Mineable Quantity -8727475 CFT)",8198840.0,BSMCL-09/2021-22/Gaya/CLUSTER- 27,2022-02-15,180,INR,,102,121,1559,2005,1,N,,4,14-02-2022,8198840.0
18726,"Laying of pipe line in Mishkar Toli, Arfabad Road to Sher Shah Road, Dr. Surendra House to Shyam Nandan House and Mehar Road, Shibli Iqbal More, Sanichara Road and house to house connection at Ward No. 54.","Laying of pipe line in Mishkar Toli, Arfabad Road to Sher Shah Road, Dr. Surendra House to Shyam Nandan House and Mehar Road, Shibli Iqbal More, Sanichara Road and house to house connection at Ward No. 54.",538.1517.1549.,"Laying of pipe line in Mishkar Toli, Arfabad Road to Sher Shah Road, Dr. Surendra House to Shyam Nandan House and Mehar Road, Shibli Iqbal More, Sanichara Road and house to house connection at Ward No. 54.",2535436.0,02/E/WSD/2022/PMC/08,2022-02-09,120,INR,,101,101,1557,1549,1,N,,6,08-02-2022,2535436.0
19598,Repairing wrok of pcc road in mikiyana mohalla from house of shah masood saheb to baby land school in ward no 15 under nagar parishad phulwari sharif,Repairing wrok of pcc road in mikiyana mohalla from house of shah masood saheb to baby land school in ward no 15 under nagar parishad phulwari sharif,538.800.823.,Repairing wrok of pcc road in mikiyana mohalla from house of shah masood saheb to baby land school in ward no 15 under nagar parishad phulwari sharif,759283.0,NIT12/2021-22/GR-39,2022-02-28,180,INR,,101,101,1557,823,1,N,,7,28-02-2022,759283.0
19340,Market complex block F to East shop construction work under Nagar Panchayat Jaynagar.,Market complex block F to East shop construction work under Nagar Panchayat Jaynagar.,538.800.837.,Market complex block F to East shop construction work under Nagar Panchayat Jaynagar.,1292937.0,NIT_No-03/2021-22/NPJ/GR-02,2022-02-23,120,INR,,101,101,1557,837,1,N,,7,23-02-2022,1292937.0
18941,"EC Approved Sandghats of Banka (Cluster - 06)
Manjhlli Deoghar road, Bhaghaunia, Kumarsar , Sahoda, Manjhali deoghar road Sand Ghat: (Mineable Quantity - 3297181.25 CFT)","EC Approved Sandghats of Banka (Cluster - 06)
Manjhlli Deoghar road, Bhaghaunia, Kumarsar , Sahoda, Manjhali deoghar road Sand Ghat: (Mineable Quantity - 3297181.25 CFT)",538.2005.,"EC Approved Sandghats of Banka (Cluster - 06)
Manjhlli Deoghar road, Bhaghaunia, Kumarsar , Sahoda, Manjhali deoghar road Sand Ghat: (Mineable Quantity - 3297181.25 CFT)",34823582.0,BSMCL-09/2021-22/BANKA/CLUSTER-06,2022-02-15,180,INR,,102,121,1559,2005,1,N,,4,14-02-2022,34823582.0
19084,"Construction of RCC drain from Dakshinbari tola gate to the land of Asho Thakur  at ward No.-15, Under Nagar Parishad, Benipur.","Construction of RCC drain from Dakshinbari tola gate to the land of Asho Thakur  at ward No.-15, Under Nagar Parishad, Benipur.",538.800.890.,"Construction of RCC drain from Dakshinbari tola gate to the land of Asho Thakur  at ward No.-15, Under Nagar Parishad, Benipur.",2663500.0,BMC-NIT-02/2021-22/GR-0026,2022-02-15,90,INR,,101,101,1557,890,1,N,,7,15-02-2022,2663500.0
18812,NAGAR PANCHAYAT KOILWAR KE WARD 13 ME GAYA MAHTO KE GHER SE VISU MAHTO KE GHER HOTE HUA RAM NATH KE GHER TAK R.C.C NALI AVM SLAB NIRMAN KARYA,NAGAR PANCHAYAT KOILWAR KE WARD 13 ME GAYA MAHTO KE GHER SE VISU MAHTO KE GHER HOTE HUA RAM NATH KE GHER TAK R.C.C NALI AVM SLAB NIRMAN KARYA,538.800.969.,NAGAR PANCHAYAT KOILWAR KE WARD 13 ME GAYA MAHTO KE GHER SE VISU MAHTO KE GHER HOTE HUA RAM NATH KE GHER TAK R.C.C NALI AVM SLAB NIRMAN KARYA,596306.0,03/2021-22/Koil G.No-12,2022-02-10,120,INR,,101,101,1557,969,1,N,,7,10-02-2022,596306.0
19335,"Construction of  RCC Staging 4Mx3Mx8M High in  At Ward No:-07 Part-3 Nagar Panchayt Marhowrah, Saran.","Construction of  RCC Staging 4Mx3Mx8M High in  At Ward No:-07 Part-3 Nagar Panchayt Marhowrah, Saran.",538.800.1246.,"Construction of  RCC Staging 4Mx3Mx8M High in  At Ward No:-07 Part-3 Nagar Panchayt Marhowrah, Saran.",627066.0,NIT-02/2021-22 Gr-06,2022-02-22,120,INR,,101,101,1557,1246,1,N,,7,22-02-2022,627066.0
19369,Construction of U/G drain & PCC Road in Darji Tola School to Kirana Halwai in ward no. 40,Construction of U/G drain & PCC Road in Darji Tola School to Kirana Halwai in ward no. 40,538.1517.1914.,Construction of U/G drain & PCC Road in Darji Tola School to Kirana Halwai in ward no. 40,710961.0,"03/E/Bankipur/2022, Group No. 05",2022-02-23,120,INR,,101,101,1557,1914,1,N,,4,23-02-2022,710961.0
19112,"Construction of  P.C.C. Road with R.C.C. Drain from Shiv Ratan Bhandariya to Devjit Gupta in F.C.I. Colony in Ward No.-14 under MMC, Muzaffarpur. GROUP-08","Construction of  P.C.C. Road with R.C.C. Drain from Shiv Ratan Bhandariya to Devjit Gupta in F.C.I. Colony in Ward No.-14 under MMC, Muzaffarpur. GROUP-08",538.800.892.,"Construction of  P.C.C. Road with R.C.C. Drain from Shiv Ratan Bhandariya to Devjit Gupta in F.C.I. Colony in Ward No.-14 under MMC, Muzaffarpur. GROUP-08",3671037.0,NIT-17/MMC/MUZAFFARPUR/2021-22/GR-08,2022-02-15,180,INR,,101,101,1557,892,1,N,,7,15-02-2022,3671037.0
18806,construction of r.c.c drain work from Nagar protection dyke to (chandrashekhar choudhary ) to Lala maheshwar pras ( post office road )  under nagar parishad khagaria for the year of 2021-22.,construction of r.c.c drain work from Nagar protection dyke to (chandrashekhar choudhary ) to Lala maheshwar pras ( post office road )  under nagar parishad khagaria for the year of 2021-22.,538.800.895.,construction of r.c.c drain work from Nagar protection dyke to (chandrashekhar choudhary ) to Lala maheshwar pras ( post office road )  under nagar parishad khagaria for the year of 2021-22.,1367107.0,NIT 10/2021-22 KHG G.No-44,2022-02-10,120,INR,,101,101,1557,895,1,N,,7,10-02-2022,1367107.0
19540,Construction of paver block road & rcc drain from khagual road to late laddu saheb in ward no 01 under nagar parishad phulwari sharif,Construction of paver block road & rcc drain from khagual road to late laddu saheb in ward no 01 under nagar parishad phulwari sharif,538.800.823.,Construction of paver block road & rcc drain from khagual road to late laddu saheb in ward no 01 under nagar parishad phulwari sharif,1673129.0,NIT12/2021-22/GR-21,2022-02-26,180,INR,,101,101,1557,823,1,N,,7,26-02-2022,1673129.0
19564,"Construction of RCC Drain and PCC road from damodar sharma to bahadur yadav hosue, paver block and rcc drain from raj kumar mistri to kapil sharma house in ward no 16.","Construction of RCC Drain and PCC road from damodar sharma to bahadur yadav hosue, paver block and rcc drain from raj kumar mistri to kapil sharma house in ward no 16.",538.800.2047.,"Construction of RCC Drain and PCC road from damodar sharma to bahadur yadav hosue, paver block and rcc drain from raj kumar mistri to kapil sharma house in ward no 16.",734898.0,07/2021-22/GR09/NPJHAJA,2022-02-27,180,INR,,101,101,1557,2047,1,N,,6,27-02-2022,734898.0
18891,"Construction of  E/w excavation/desilting of Fardo Nala in town Portion from Kalyani to Damuchak Railway Culvert under MMC, Muzaffarpur. GROUP-01","Construction of  E/w excavation/desilting of Fardo Nala in town Portion from Kalyani to Damuchak Railway Culvert under MMC, Muzaffarpur. GROUP-01",538.800.892.,"Construction of  E/w excavation/desilting of Fardo Nala in town Portion from Kalyani to Damuchak Railway Culvert under MMC, Muzaffarpur. GROUP-01",17999273.0,NIT-16/MMC/2021-22/MUZAFFARPUR/GR-01,2022-02-12,180,INR,,101,101,1557,892,2,N,,7,12-02-2022,17999273.0
18655,Construction of Water supply scheme (500 H.H) in ward no 19 at Nagar Parishad Forbesganj.,Construction of Water supply scheme (500 H.H) in ward no 19 at Nagar Parishad Forbesganj.,538.800.818.,Construction of Water supply scheme (500 H.H) in ward no 19 at Nagar Parishad Forbesganj.,9863566.0,NPFORBESGANJ/RE-TENDAR-NO-13/2021-22/GR-05,2022-02-03,120,INR,,102,101,1557,818,2,N,,7,02-02-2022,9863566.0
18800,"construction of p.c.c road work from house of Girish yadav to shambhavi jal in ward no-25, under nagar parishad khagaria for the year of 2021-22.","construction of p.c.c road work from house of Girish yadav to shambhavi jal in ward no-25, under nagar parishad khagaria for the year of 2021-22.",538.800.895.,"construction of p.c.c road work from house of Girish yadav to shambhavi jal in ward no-25, under nagar parishad khagaria for the year of 2021-22.",229986.0,NIT 10/2021-22 KHG G.No-38,2022-02-10,120,INR,,101,101,1557,895,1,N,,7,10-02-2022,229986.0
19413,Construction of U/G drain and PCC Road from house of Azad Kurashi to house of Javed Cycle in ward no. 40.,Construction of U/G drain and PCC Road from house of Azad Kurashi to house of Javed Cycle in ward no. 40.,538.1517.1914.,Construction of U/G drain and PCC Road from house of Azad Kurashi to house of Javed Cycle in ward no. 40.,545043.0,"NIT No - 03/E/Bankipur/2022, Gr. No. 11",2022-02-24,120,INR,,101,101,1557,1914,1,N,,4,24-02-2022,545043.0
19542,Construction of pcc road & drain in new mollat colony sector 02 from house of  jahir mallick via house of sabbir khan via house of khursid khan to house of siruj uddin ansari in ward no 05 under nagar parishad phulwari sharif,Construction of pcc road & drain in new mollat colony sector 02 from house of  jahir mallick via house of sabbir khan via house of khursid khan to house of siruj uddin ansari in ward no 05 under nagar parishad phulwari sharif,538.800.823.,Construction of pcc road & drain in new mollat colony sector 02 from house of  jahir mallick via house of sabbir khan via house of khursid khan to house of siruj uddin ansari in ward no 05 under nagar parishad phulwari sharif,1009231.0,NIT12/2021-22/GR-23,2022-02-26,180,INR,,101,101,1557,823,1,N,,7,26-02-2022,1009231.0
19214,Construction of  PCC Road from PCC road to Lal singh house and Rajesh kumar jha house  ??? in Ward no 15.(Detail as per NIT),Construction of  PCC Road from PCC road to Lal singh house and Rajesh kumar jha house  ??? in Ward no 15.(Detail as per NIT),538.800.825.,Construction of  PCC Road from PCC road to Lal singh house and Rajesh kumar jha house  ??? in Ward no 15.(Detail as per NIT),1046300.0,NP/SHC/NIT04/2021-22/Gr-17,2022-02-17,120,INR,,101,101,1557,825,1,N,,7,17-02-2022,1046300.0
18810,"NAGAR PANCHAYAT KOILWAR KE WARD 10 ME
SUBARATI MIYA KE GHER SE GULAB NABI KE GHER HOTA HUA PURANA POSTOFFICE TAK R.C.C NALI AVM SLAB NIRMAN KARYA","NAGAR PANCHAYAT KOILWAR KE WARD 10 ME
SUBARATI MIYA KE GHER SE GULAB NABI KE GHER HOTA HUA PURANA POSTOFFICE TAK R.C.C NALI AVM SLAB NIRMAN KARYA",538.800.969.,"NAGAR PANCHAYAT KOILWAR KE WARD 10 ME
SUBARATI MIYA KE GHER SE GULAB NABI KE GHER HOTA HUA PURANA POSTOFFICE TAK R.C.C NALI AVM SLAB NIRMAN KARYA",775622.0,03/2021-22/Koil G.No-10,2022-02-10,120,INR,,101,101,1557,969,1,N,,7,10-02-2022,775622.0
19640,Construction of P.C.C. Road and R.C.C. Drain in Dhobaniya Gali from the House of Mahendra Ji to Kamla School under ward no. 58 in Azimabad Division PMC Patna,Construction of P.C.C. Road and R.C.C. Drain in Dhobaniya Gali from the House of Mahendra Ji to Kamla School under ward no. 58 in Azimabad Division PMC Patna,538.1517.1548.,Construction of P.C.C. Road and R.C.C. Drain in Dhobaniya Gali from the House of Mahendra Ji to Kamla School under ward no. 58 in Azimabad Division PMC Patna,254695.0,NIT-15/E/AZIMABAD/2021-22_GR15,2022-02-28,120,INR,,101,101,1557,1548,1,N,,6,28-02-2022,254695.0
18643,"Laying water supply pipe line in Rajeshwari Saw House, Kuwargali Gaya to Sanjeev House and house to house connection at Ward No. 22-B.","Laying water supply pipe line in Rajeshwari Saw House, Kuwargali Gaya to Sanjeev House and house to house connection at Ward No. 22-B.",538.1517.1549.,"Laying water supply pipe line in Rajeshwari Saw House, Kuwargali Gaya to Sanjeev House and house to house connection at Ward No. 22-B.",6154192.0,01/E/WSD/2022/PMC/03,2022-02-03,120,INR,,101,101,1557,1549,2,N,,6,02-02-2022,6154192.0
19552,Construction of  R.C.C Staging & Water Tank in Ward No-07 Under Nagar Panchayat Khusrupur. (Re-Tender),Construction of  R.C.C Staging & Water Tank in Ward No-07 Under Nagar Panchayat Khusrupur. (Re-Tender),538.800.1959.1960.1961.,Construction of  R.C.C Staging & Water Tank in Ward No-07 Under Nagar Panchayat Khusrupur. (Re-Tender),570615.0,NIT 10/2021-22/NVPPE Gr.-07 (Re Tender),2022-02-26,120,INR,,101,101,1557,1961,1,N,,4,26-02-2022,570615.0
19220,Construction of Drain cum PCC Road from Bindeswari Yadav PP Saheb house to Kapsia house via?????. in Ward no 12.(Detail as per NIT),Construction of Drain cum PCC Road from Bindeswari Yadav PP Saheb house to Kapsia house via?????. in Ward no 12.(Detail as per NIT),538.800.825.,Construction of Drain cum PCC Road from Bindeswari Yadav PP Saheb house to Kapsia house via?????. in Ward no 12.(Detail as per NIT),1982000.0,NP/SHC/NIT04/2021-22/Gr-23,2022-02-17,120,INR,,101,101,1557,825,1,N,,7,17-02-2022,1982000.0
19042,"EC Approved Sandghats of GAYA (Cluster- 60)
MARANCHI SAND GHAT (Mineable Quantity -9613038CFT)","EC Approved Sandghats of GAYA (Cluster- 60)
MARANCHI SAND GHAT (Mineable Quantity -9613038CFT)",538.2005.,"EC Approved Sandghats of GAYA (Cluster- 60)
MARANCHI SAND GHAT (Mineable Quantity -9613038CFT)",7869422.0,BSMCL-09/2021-22/Gaya/CLUSTER- 60,2022-02-15,180,INR,,102,121,1559,2005,1,N,,4,15-02-2022,7869422.0
19078,"Construction of RCC drain from the house of Bela Sahu to the house of Bihar Sarkar (Gaddha)  at ward No.-11, Under Nagar Parishad, Benipur.","Construction of RCC drain from the house of Bela Sahu to the house of Bihar Sarkar (Gaddha)  at ward No.-11, Under Nagar Parishad, Benipur.",538.800.890.,"Construction of RCC drain from the house of Bela Sahu to the house of Bihar Sarkar (Gaddha)  at ward No.-11, Under Nagar Parishad, Benipur.",710800.0,BMC-NIT-02/2021-22/GR-0020,2022-02-15,90,INR,,101,101,1557,890,1,N,,7,15-02-2022,710800.0
19130,"Construction of  P.C.C. Road and Drain from House of Ladle Ji to the House of Daudi Saheb in Mehta Compound Ajad Road in Ward No.-43 under MMC, Muzaffarpur. GROUP-18","Construction of  P.C.C. Road and Drain from House of Ladle Ji to the House of Daudi Saheb in Mehta Compound Ajad Road in Ward No.-43 under MMC, Muzaffarpur. GROUP-18",538.800.892.,"Construction of  P.C.C. Road and Drain from House of Ladle Ji to the House of Daudi Saheb in Mehta Compound Ajad Road in Ward No.-43 under MMC, Muzaffarpur. GROUP-18",864598.0,NIT-17/MMC/MUZAFFARPUR/2021-22/GR-18,2022-02-15,180,INR,,101,101,1557,892,1,N,,7,15-02-2022,864598.0
19299,"REPAIR & MAINTENANCE OF A.F.S. GATES WITH HOISTING ARRANGEMENT AT 1.90, 4.21, 7.00, 8.27, 10.00, 14.20 AND 15.00 KM OF NEPAL PORTION AND AT 1.60 (DRB), 24.50, 25.20, 25.50, 30.00 KM, MAHADEVMOTH, NRB-I, NRB-II AND NRB-III OF INDIA PORTION OF WESTERN KOSHI EMBANKMENT AND AT 7.60 KM OF WESTERN AFFLUX BUNDH BEFORE FLOOD PERIOD 2022","REPAIR & MAINTENANCE OF A.F.S. GATES WITH HOISTING ARRANGEMENT AT 1.90, 4.21, 7.00, 8.27, 10.00, 14.20 AND 15.00 KM OF NEPAL PORTION AND AT 1.60 (DRB), 24.50, 25.20, 25.50, 30.00 KM, MAHADEVMOTH, NRB-I, NRB-II AND NRB-III OF INDIA PORTION OF WESTERN KOSHI EMBANKMENT AND AT 7.60 KM OF WESTERN AFFLUX BUNDH BEFORE FLOOD PERIOD 2022",538.731.1051.1057.,"REPAIR & MAINTENANCE OF A.F.S. GATES WITH HOISTING ARRANGEMENT AT 1.90, 4.21, 7.00, 8.27, 10.00, 14.20 AND 15.00 KM OF NEPAL PORTION AND AT 1.60 (DRB), 24.50, 25.20, 25.50, 30.00 KM, MAHADEVMOTH, NRB-I, NRB-II AND NRB-III OF INDIA PORTION OF WESTERN KOSHI EMBANKMENT AND AT 7.60 KM OF WESTERN AFFLUX BUNDH BEFORE FLOOD PERIOD 2022",2205622.0,NIT: 15/2021-22/BIRPURDIV,2022-02-22,120,INR,,101,101,1556,1057,2,N,,7,22-02-2022,2205622.0
19256,Construction of SADABHAWANA Mandap at Dagarua in Purnea Distt for the year 2021-22,Construction of SADABHAWANA Mandap at Dagarua in Purnea Distt for the year 2021-22,538.1026.1096.1219.1220.,Construction of SADABHAWANA Mandap at Dagarua in Purnea Distt for the year 2021-22,8531090.0,10/BCD/PURNEA/2021-22,2022-02-17,120,INR,,101,101,1557,1220,2,N,,7,17-02-2022,8531090.0
18922,"EC Approved Sand Ghat of Aurangabad (Cluster-43) 
SAIRA GHAT  &  AAJHO  GHAT  :( MINEABLE QUANTITY- 2023412.13 CFT)","EC Approved Sand Ghat of Aurangabad (Cluster-43) 
SAIRA GHAT  &  AAJHO  GHAT  :( MINEABLE QUANTITY- 2023412.13 CFT)",538.2005.,"EC Approved Sand Ghat of Aurangabad (Cluster-43) 
SAIRA GHAT  &  AAJHO  GHAT  :( MINEABLE QUANTITY- 2023412.13 CFT)",11909108.0,BSMCL-09/2021-22/AURANGABAD/CLUSTER-43,2022-02-14,180,INR,,102,121,1559,2005,1,N,,4,13-02-2022,11909108.0
19400,Construction of Nala &  PCC work From Arvind Singh House to Raj Sinha House In ward no-30 .(Detail as per NIT),Construction of Nala &  PCC work From Arvind Singh House to Raj Sinha House In ward no-30 .(Detail as per NIT),538.800.825.,Construction of Nala &  PCC work From Arvind Singh House to Raj Sinha House In ward no-30 .(Detail as per NIT),3229000.0,NP/SHC/NIT04/2021-22/Gr-71,2022-02-24,120,INR,,101,101,1557,825,1,N,,7,24-02-2022,3229000.0
18921,"EC Approved Sand Ghat of Aurangabad (Cluster-42) 
ITAR GHAT  & BETANIYA  GHAT  :( MINEABLE QUANTITY- 1839465.5 CFT)","EC Approved Sand Ghat of Aurangabad (Cluster-42) 
ITAR GHAT  & BETANIYA  GHAT  :( MINEABLE QUANTITY- 1839465.5 CFT)",538.2005.,"EC Approved Sand Ghat of Aurangabad (Cluster-42) 
ITAR GHAT  & BETANIYA  GHAT  :( MINEABLE QUANTITY- 1839465.5 CFT)",10826462.0,BSMCL-09/2021-22/AURANGABAD/CLUSTER-42,2022-02-14,180,INR,,102,121,1559,2005,1,N,,4,13-02-2022,10826462.0
18675,construction of  toiletin front of makhdumur thana near mask light,construction of  toiletin front of makhdumur thana near mask light,538.800.848.,construction of  toiletin front of makhdumur thana near mask light,2834590.0,NI5/2021-22 g004,2022-02-07,120,INR,,101,101,1557,848,2,N,,7,04-02-2022,2834590.0
18777,"construction of p.c.c road work from house of Rajeev kumar to connected bijli grid road via house of er.premchand singh in ward no-15, under nagar parishad khagaria for the year of 2021-22.","construction of p.c.c road work from house of Rajeev kumar to connected bijli grid road via house of er.premchand singh in ward no-15, under nagar parishad khagaria for the year of 2021-22.",538.800.895.,"construction of p.c.c road work from house of Rajeev kumar to connected bijli grid road via house of er.premchand singh in ward no-15, under nagar parishad khagaria for the year of 2021-22.",1545065.0,NIT 10/2021-22 KHG G.No-15,2022-02-10,120,INR,,101,101,1557,895,1,N,,7,09-02-2022,1545065.0
18684,NIT 02/2021-22 Group 03,"Renovation of Husainpur Ahar, Pyne Scheme Under M.I. Division Nalanda",538.1420.1422.1425.1435.,NIT 02/2021-22 Group 03,4636386.0,"02/2021-22 MID, Nalanda Group 03",2022-02-06,120,INR,,101,101,1557,1435,2,N,,7,06-02-2022,4636386.0
19276,"Construction of 14 nos. of 125mm dia x 55m deep Gravel packed T/well  and 07 nos. of 125/115mm dia x 70m deep Drilled T/well with India Mark II Hand Pump with Platform and drain in Place of defunct handpump in Rural  area of Sheikhpura District  under  P.H. Division, Sheikhpura for the year 2020-21.","Construction of 14 nos. of 125mm dia x 55m deep Gravel packed T/well  and 07 nos. of 125/115mm dia x 70m deep Drilled T/well with India Mark II Hand Pump with Platform and drain in Place of defunct handpump in Rural  area of Sheikhpura District  under  P.H. Division, Sheikhpura for the year 2020-21.",538.790.1027.1030.1039.,"Construction of 14 nos. of 125mm dia x 55m deep Gravel packed T/well  and 07 nos. of 125/115mm dia x 70m deep Drilled T/well with India Mark II Hand Pump with Platform and drain in Place of defunct handpump in Rural  area of Sheikhpura District  under  P.H. Division, Sheikhpura for the year 2020-21.",1461700.0,"09/R/PHED/SHK/2021-22  ,GR-01",2022-02-19,180,INR,,101,101,1557,1039,2,N,,7,19-02-2022,1461700.0
19529,Construction of rcc drian in haroon nagar road no 10A from house of anis ansari saheb via house of aftab khan to house of mallick jee and from house of Dr perwez saheb via house of pappu khan via house of nehal saheb to house of devid saheb in ward no 09 under nagar parishad phulwari sharif,Construction of rcc drian in haroon nagar road no 10A from house of anis ansari saheb via house of aftab khan to house of mallick jee and from house of Dr perwez saheb via house of pappu khan via house of nehal saheb to house of devid saheb in ward no 09 under nagar parishad phulwari sharif,538.800.823.,Construction of rcc drian in haroon nagar road no 10A from house of anis ansari saheb via house of aftab khan to house of mallick jee and from house of Dr perwez saheb via house of pappu khan via house of nehal saheb to house of devid saheb in ward no 09 under nagar parishad phulwari sharif,1804390.0,NIT12/2021-22/GR-10,2022-02-26,180,INR,,101,101,1557,823,1,N,,7,26-02-2022,1804390.0
18825,"Construction of  R.C.C. Drain from Vishwanath Vivah Bhawan North Side via Dr. Tarun House to Late Dr. Akhter House in Nawab Road in Ward No.-16 under MMC, Muzaffarpur. GROUP-07","Construction of  R.C.C. Drain from Vishwanath Vivah Bhawan North Side via Dr. Tarun House to Late Dr. Akhter House in Nawab Road in Ward No.-16 under MMC, Muzaffarpur. GROUP-07",538.800.892.,"Construction of  R.C.C. Drain from Vishwanath Vivah Bhawan North Side via Dr. Tarun House to Late Dr. Akhter House in Nawab Road in Ward No.-16 under MMC, Muzaffarpur. GROUP-07",4819173.0,NIT-15/MMC/MUZAFFARPUR/2021-22/GR-07,2022-02-10,180,INR,,101,101,1557,892,1,N,,6,10-02-2022,4819173.0
18872,"DETAILED ESTIMATE FOR THE CONSTRUCTION OF DRAIN WITH COVER FROM THE HOUSE OF YASHODHAR YADAV TO THE HOUSE OF SHASHI SHEKHAR IN WARD NO-02 IN UNDER NAGAR PANCHAYAT, NIRMALI (SUPAUL)","DETAILED ESTIMATE FOR THE CONSTRUCTION OF DRAIN WITH COVER FROM THE HOUSE OF YASHODHAR YADAV TO THE HOUSE OF SHASHI SHEKHAR IN WARD NO-02 IN UNDER NAGAR PANCHAYAT, NIRMALI (SUPAUL)",538.800.1241.,"DETAILED ESTIMATE FOR THE CONSTRUCTION OF DRAIN WITH COVER FROM THE HOUSE OF YASHODHAR YADAV TO THE HOUSE OF SHASHI SHEKHAR IN WARD NO-02 IN UNDER NAGAR PANCHAYAT, NIRMALI (SUPAUL)",443900.0,NIT-06/2021-22/GR - 01/NIRMALI,2022-02-14,180,INR,,101,101,1557,1241,1,N,,7,11-02-2022,443900.0
19531,Construction of rcc drain & pcc road in adrash nagar road no 01 from house of arjun singh to house of mahmood bhai haroon nagar 02 in ward no 08 under nagar parishad phulwari sharif,Construction of rcc drain & pcc road in adrash nagar road no 01 from house of arjun singh to house of mahmood bhai haroon nagar 02 in ward no 08 under nagar parishad phulwari sharif,538.800.823.,Construction of rcc drain & pcc road in adrash nagar road no 01 from house of arjun singh to house of mahmood bhai haroon nagar 02 in ward no 08 under nagar parishad phulwari sharif,2130456.0,NIT12/2021-22/GR-12,2022-02-26,180,INR,,101,101,1557,823,1,N,,7,26-02-2022,2130456.0
19192,Nibandhan karyalay Amber mor par awasthit sauchalay avam mutralay ke gande paani ke nikas ke liye nail ka nirman.,Nibandhan karyalay Amber mor par awasthit sauchalay avam mutralay ke gande paani ke nikas ke liye nail ka nirman.,538.800.1406.,Nibandhan karyalay Amber mor par awasthit sauchalay avam mutralay ke gande paani ke nikas ke liye nail ka nirman.,168900.0,NIT NO. -01/2022 GR-02,2022-02-16,120,INR,,101,101,1557,1406,1,N,,7,16-02-2022,168900.0
